image_id,unixtime,rawtime,title,total_votes,reddit_id,number_of_upvotes,subreddit,number_of_downvotes,localtime,score,number_of_comments,username
0,1622073146.0,2021-05-2623:52:26,the harness stays on while you breed me 😜,39286,nluv99,39286,BreedingMaterial,0,2021-05-2616:52:26,0,319,coupleintimacy
0,1612111805.0,2021-01-3116:50:05,"I’d like to know out of the 4,500 people online rn how many would put a baby in me please 🤗",33882,l9g6vf,32866,BreedingMaterial,1016,2021-01-3108:50:05,0,699,RubysRoses1
0,1610305756.0,2021-01-1019:09:16,I wonder how many of you just have a breeding fetish and how many would actually put a baby in me,26509,kukjlo,25714,BreedingMaterial,795,2021-01-1011:09:16,0,635,RubysRoses1
0,1610673722.0,2021-01-1501:22:02,"5'1 Slightly chubby college student, am I breedable to you?",24784,kxjr4j,24289,BreedingMaterial,495,2021-01-1417:22:02,0,559,sarahshaye
0,1612175129.0,2021-02-0110:25:29,Would you like to breed a fit girl?,21618,la05iv,21186,BreedingMaterial,432,2021-02-0102:25:29,0,233,tastynova
0,1606555371.0,2020-11-2809:22:51,cursed_happyman,27064,k2kt0p,26794,cursedimages,270,2020-11-2801:22:51,0,255,AngstX
0,1606172240.0,2020-11-2322:57:20,cursed_visitor,27589,jzsnro,26486,cursedimages,1103,2020-11-2314:57:20,0,327,cursed_napkin
0,1608292197.0,2020-12-1811:49:57,cursed_encounter,26834,kfjphe,26298,cursedimages,536,2020-12-1803:49:57,0,391,cursed_napkin
0,1606910408.0,2020-12-0212:00:08,cursed_gift,26535,k57ykn,25739,cursedimages,796,2020-12-0204:00:08,0,267,cursed_napkin
0,1611179650.0,2021-01-2021:54:10,cursed_ride,26020,l1jjn8,25500,cursedimages,520,2021-01-2013:54:10,0,307,coby22771
0,1614099695.0,2021-02-2317:01:35,Abandoned Chuck E. Cheese animatronic found in a landfill,53750,lqn8d6,51063,AbandonedPorn,2687,2021-02-2309:01:35,0,1412,Import
0,1610931654.0,2021-01-1801:00:54,16 mile hike to an abandoned Train track bridge in California.,48131,kzjgpe,46688,AbandonedPorn,1443,2021-01-1717:00:54,0,851,Vincent_Baldwin
0,1630618242.0,2021-09-0221:30:42,"Bethlehem Steel, the factory that built NYC",38645,pgr6mk,37486,AbandonedPorn,1159,2021-09-0214:30:42,0,1093,urbexandchill
0,1609370388.0,2020-12-3023:19:48,Abandoned church purchased by skaters and renovated into a dream park,31204,kndehn,29644,AbandonedPorn,1560,2020-12-3015:19:48,0,686,mcmuchomas
0,1612065802.0,2021-01-3104:03:22,Abandoned Duesenberg,26440,l941ex,24854,AbandonedPorn,1586,2021-01-3020:03:22,0,402,Perfect_Gas
0,1607713102.0,2020-12-1118:58:22,FBI confirms that the Zodiac Killer’s “340 Cypher” has been cracked,61317,kb8v2h,59478,UnresolvedMysteries,1839,2020-12-1110:58:22,0,2823,JTigertail
0,1613172372.0,2021-02-1223:26:12,Why I stopped watching the Elisa Lam documentary,26114,linojx,24548,UnresolvedMysteries,1566,2021-02-1215:26:12,0,3396,
0,1630773313.0,2021-09-0416:35:13,"1991: a man vanishes after telling his family he's going on a business trip. 2021: a car stops in front of this man's home and drops him off. He is wearing the same clothes, can't remember where he's been all these years & is looking like he was very well taken care of. The curious case of Mr Gorgos",15576,phutqw,15109,UnresolvedMysteries,467,2021-09-0409:35:13,0,1159,prajitoruldinoz
0,1619555856.0,2021-04-2720:37:36,Man charged with attempted murder is now being investigated for ties to the Delphi killings,14953,mzy00e,14505,UnresolvedMysteries,448,2021-04-2713:37:36,0,1788,Philodemus1984
0,1618737686.0,2021-04-1809:21:26,"It's been 4 years, and despite viral CCTV evidence, no one has found the Putney Bridge jogger who seemingly randomly and without provocation pushed a women in the path of a moving bus and then calmly continued jogging.",15089,mt9jei,14486,UnresolvedMysteries,603,2021-04-1802:21:26,0,589,Mobile_Dimension_423
0,1613510021.0,2021-02-1621:13:41,One line light painting of a coyote [OC][1200x1500],2952,lldtgy,2923,ExposurePorn,29,2021-02-1613:13:41,0,40,dariustwin
0,1609102361.0,2020-12-2720:52:41,Seattle Washington Sunset [OC] [3778x4723],2876,klb8sc,2848,ExposurePorn,28,2020-12-2712:52:41,0,24,Whitfields_Lens
0,1612984450.0,2021-02-1019:14:10,One line light painting of a deer [OC][1200x960],2657,lh186l,2631,ExposurePorn,26,2021-02-1011:14:10,0,31,dariustwin
0,1609719436.0,2021-01-0400:17:16,The Man and The Milky Way [896x1120],2494,kpwok4,2470,ExposurePorn,24,2021-01-0316:17:16,0,39,landscapeluke
0,1610032810.0,2021-01-0715:20:10,A temperature of -27 celcius produces unique clarity and atmosphere to long exposure winter night photos [1920x1080][OC],2490,ksfbtf,2466,ExposurePorn,24,2021-01-0707:20:10,0,27,Genelecci
0,1610625329.0,2021-01-1411:55:29,Can’t explain to the elderly that they don’t need an oil change after 8mo/23 miles.,57536,kx49by,55810,Justrolledintotheshop,1726,2021-01-1403:55:29,0,2992,Brianthelion83
0,1611519639.0,2021-01-2420:20:39,Sick under glow on customers F-150. All 4 wheels wells are like this,45491,l46qi6,43217,Justrolledintotheshop,2274,2021-01-2412:20:39,0,844,Pride_Bunny
0,1629545361.0,2021-08-2111:29:21,"I was the only Toyota tech in the dealership this week due to a tech family emergency, and another on vacation. 111 hrs booked in a 40 hr week. I'm exhausted.",45311,p8pu2s,42593,Justrolledintotheshop,2718,2021-08-2104:29:21,0,2759,Low_Teq
0,1610379524.0,2021-01-1115:38:44,Customer's vehicle has been overheating for the past month,40049,kv50jb,38848,Justrolledintotheshop,1201,2021-01-1107:38:44,0,1735,cdmertz
0,1615650708.0,2021-03-1315:51:48,Guy said he hadn’t changed his oil in a couple months.,39757,m48xel,38565,Justrolledintotheshop,1192,2021-03-1307:51:48,0,2020,International_Law755
0,1610893776.0,2021-01-1714:29:36,Just stop being poor,154024,kz7dgw,126300,PoliticalHumor,27724,2021-01-1706:29:36,0,4115,slytherinchosenone
0,1611695197.0,2021-01-2621:06:37,Shots fired! 😯,137984,l5nobv,117287,PoliticalHumor,20697,2021-01-2613:06:37,0,2958,farlz84
0,1607889699.0,2020-12-1320:01:39,Oh Ted....,123334,kchj77,111001,PoliticalHumor,12333,2020-12-1312:01:39,0,1672,Raskel_61
0,1612738225.0,2021-02-0722:50:25,Darkest comedy ... Bernie explaining Cayman Islands in simple terms,120119,lexs1g,110510,PoliticalHumor,9609,2021-02-0714:50:25,0,1719,nj23dublin
0,1618697612.0,2021-04-1722:13:32,Earned trust,133071,mt0bqc,107788,PoliticalHumor,25283,2021-04-1715:13:32,0,2863,VaxxedIn2021
0,1610625234.0,2021-01-1411:53:54,Me showing up to work on Monday knowinh full well that my boss has seen my tits online,28731,kx48n1,27582,BiggerThanYouThought,1149,2021-01-1403:53:54,0,232,leahgoeswilde
0,1611668060.0,2021-01-2613:34:20,Can you tell how sexually frustrated I am being in lock down? (18f),27855,l5e2w2,27298,BiggerThanYouThought,557,2021-01-2605:34:20,0,377,Your_submissive_doll
0,1613655502.0,2021-02-1813:38:22,I'm just the girl next door (OC),25336,lmmylr,24576,BiggerThanYouThought,760,2021-02-1805:38:22,0,187,rocketbabey
0,1607272734.0,2020-12-0616:38:54,Exactly why I don’t wear bras... my boobs need to be free,22524,k7wxvw,21849,BiggerThanYouThought,675,2020-12-0608:38:54,0,268,PandoraNyxie
0,1623106891.0,2021-06-0723:01:31,I want to show you my secret,20920,nuq6vu,20711,BiggerThanYouThought,209,2021-06-0716:01:31,0,170,gigii517
0,1606743932.0,2020-11-3013:45:32,I made a phone stand to turn your smartphone in a cozy fireplace,10907,k3w1bq,10798,somethingimade,109,2020-11-3005:45:32,0,272,timmmmmmmmmmmm
0,1610540684.0,2021-01-1312:24:44,I'm a 16 yr old blacksmith and I forged this whale bottle opener :) hope you like it!,5619,kwfeq0,5563,somethingimade,56,2021-01-1304:24:44,0,140,benperky10
0,1634056995.0,2021-10-1216:43:15,I made this sweatshirt out of a blanket I got at my local thrift store and it’s probably my favorite thing I’ve made so far:),5240,q6qbcy,5188,somethingimade,52,2021-10-1209:43:15,0,114,reillyfitz
0,1625060570.0,2021-06-3013:42:50,I make bumper stickers that challenge stereotypical narratives about women.,5283,oaxlmi,5072,somethingimade,211,2021-06-3006:42:50,0,102,weenphisher76
0,1608919702.0,2020-12-2518:08:22,I made these ceramic items that look like Solo jazz cups.,5051,kk38nx,5001,somethingimade,50,2020-12-2510:08:22,0,54,RestEqualsRust
0,1611930601.0,2021-01-2914:30:01,Invest for the working class!,37030,l7tv40,35549,MemeEconomy,1481,2021-01-2906:30:01,0,272,STVN92
0,1612210897.0,2021-02-0120:21:37,INVEST in dancing girl unaware of coup,34562,lad0sd,32489,MemeEconomy,2073,2021-02-0112:21:37,0,1020,-not-my-account-
0,1617471222.0,2021-04-0317:33:42,Invest with your own card,35915,mjd55e,31965,MemeEconomy,3950,2021-04-0310:33:42,0,290,itsastroworldmfs
0,1607249330.0,2020-12-0610:08:50,a interesting invest for my saltybois across the pond,33605,k7r7vp,31589,MemeEconomy,2016,2020-12-0602:08:50,0,241,KyloRenKardashian
0,1606429037.0,2020-11-2622:17:17,The purr-fect template to invest to!,32277,k1on0d,30664,MemeEconomy,1613,2020-11-2614:17:17,0,211,Cipeesek
0,1606725220.0,2020-11-3008:33:40,Toilet bowl seems to be really pissed about me throwing grenade into him,36079,k3s0ij,34997,Rainbow6,1082,2020-11-3000:33:40,0,232,mouri_314
0,1615034004.0,2021-03-0612:33:24,How to fall down a ledge without dying (Useful if you want to go down a ledge quick without dying),32672,lz0om9,31366,Rainbow6,1306,2021-03-0604:33:24,0,277,actuallyyourfloor
0,1607524507.0,2020-12-0914:35:07,All Year 5 Operators,31327,k9svze,30074,Rainbow6,1253,2020-12-0906:35:07,0,730,tuhokas
0,1615885320.0,2021-03-1609:02:00,They be starving,29664,m64qus,28775,Rainbow6,889,2021-03-1602:02:00,0,201,yoyo5boiiii
0,1608489229.0,2020-12-2018:33:49,We made Chalet out of gingerbread!,29313,kgzd2a,28434,Rainbow6,879,2020-12-2010:33:49,0,451,elZu96
0,1618174013.0,2021-04-1120:46:53,cadiaN career play,32974,moz10m,30996,GlobalOffensive,1978,2021-04-1113:46:53,0,1199,Papercs
0,1614102201.0,2021-02-2317:43:21,This guy really thought he was going to clutch the Knife Round,25737,lqo8lr,25223,GlobalOffensive,514,2021-02-2309:43:21,0,364,Rngd-
0,1609265705.0,2020-12-2918:15:05,I pulled off a game winning ninja defuse while being on 2hp and blocking a shot with a flashbang,21611,kmjlgw,20963,GlobalOffensive,648,2020-12-2910:15:05,0,224,Vitalcsgo
0,1609775734.0,2021-01-0415:55:34,"Apartment burned down, but my signed C9 jersey survived",21423,kqbeva,20138,GlobalOffensive,1285,2021-01-0407:55:34,0,310,Dacvid
0,1631610906.0,2021-09-1409:15:06,What are the odds?,18025,pnz955,17485,GlobalOffensive,540,2021-09-1402:15:06,0,300,Aussyow
0,1618196256.0,2021-04-1202:57:36,Thanks I hate Philadelphia,109474,mp5gj7,101811,TIHI,7663,2021-04-1119:57:36,0,2203,ivanwafles67
0,1606142237.0,2020-11-2314:37:17,Thanks I hate these customers,99791,jziplc,93804,TIHI,5987,2020-11-2306:37:17,0,811,I_need_to_learn_more
0,1610645049.0,2021-01-1417:24:09,"Thanks, I hate gummy universe",97272,kxa5o9,92409,TIHI,4863,2021-01-1409:24:09,0,649,DronsiCrnjo
0,1612695084.0,2021-02-0710:51:24,"Thanks, I hate trying for a baby",95087,lekbij,86530,TIHI,8557,2021-02-0702:51:24,0,1749,Scaulbylausis
0,1614176221.0,2021-02-2414:17:01,"Thanks, I hate Stuart Little",86076,lrdwfp,81773,TIHI,4303,2021-02-2406:17:01,0,577,MrEpicUsername
0,1630104510.0,2021-08-2722:48:30,anime_irl,37484,pcxzf1,34486,anime_irl,2998,2021-08-2715:48:30,0,415,NekoWafers
0,1618601979.0,2021-04-1619:39:39,anime_irl,32032,msas3u,30431,anime_irl,1601,2021-04-1612:39:39,0,342,Faith_SC
0,1633972539.0,2021-10-1117:15:39,anime_irl,32546,q60pcd,28641,anime_irl,3905,2021-10-1110:15:39,0,814,Shayecube
0,1627811430.0,2021-08-0109:50:30,anime_irl,29962,ovpdee,28464,anime_irl,1498,2021-08-0102:50:30,0,148,NekoWafers
0,1634914257.0,2021-10-2214:50:57,anime_irl,31058,qdikhx,28263,anime_irl,2795,2021-10-2207:50:57,0,451,haxah
0,1611822858.0,2021-01-2808:34:18,My B.M.I is apparently infinite.,47502,l6rvfu,45602,softwaregore,1900,2021-01-2800:34:18,0,811,_CxxcT_GD_
0,1613732440.0,2021-02-1911:00:40,Trying to set the time to 7.30pm in an Outlook calendar evebt using the web browser,38779,lnd8uz,37228,softwaregore,1551,2021-02-1903:00:40,0,565,distractonaut
0,1629862577.0,2021-08-2503:36:17,Quite a nice run I had this evening,37832,pb35da,36698,softwaregore,1134,2021-08-2420:36:17,0,691,Txy_
0,1624503468.0,2021-06-2402:57:48,Shifting into maximum overdrive,37129,o6s4fd,35644,softwaregore,1485,2021-06-2319:57:48,0,461,dragoninmyanus
0,1610342601.0,2021-01-1105:23:21,My fps counter decided it wanted attention,36161,kuw28y,35077,softwaregore,1084,2021-01-1021:23:21,0,399,LavaGS_
0,1611227704.0,2021-01-2111:15:04,Alright drop em,68159,l1wisd,65433,WhatsWrongWithYourDog,2726,2021-01-2103:15:04,0,755,My_Memes_Will_Cure_U
0,1633785839.0,2021-10-0913:23:59,Recently bought a dog cam... Our pit enjoying the house to himself,70234,q4la1s,63913,WhatsWrongWithYourDog,6321,2021-10-0906:23:59,0,666,Enigmatologists
0,1618970906.0,2021-04-2102:08:26,Just how water should be drank.,57159,mv612d,54873,WhatsWrongWithYourDog,2286,2021-04-2019:08:26,0,680,My_Memes_Will_Cure_U
0,1624497905.0,2021-06-2401:25:05,Them: Are Huskies really that much crazier than other dogs? Me:,55805,o6qm18,53573,WhatsWrongWithYourDog,2232,2021-06-2318:25:05,0,818,5_Frog_Margin
0,1629216364.0,2021-08-1716:06:04,When you're good at your job but kind of dumb at the same time,56034,p66uhu,53233,WhatsWrongWithYourDog,2801,2021-08-1709:06:04,0,556,Thryloz
0,1621479739.0,2021-05-2003:02:19,"[NEWS] Kentaro Miura, Author of Berserk, Has Passed Away",31819,ngozw5,31819,manga,0,2021-05-1920:02:19,0,2068,dorkmax_executives
0,1621505844.0,2021-05-2010:17:24,[ART] Shun Saeki (Shokugeki no Soma)'s tribute to Kentaro Miura,20665,ngwewq,20665,manga,0,2021-05-2003:17:24,0,166,zenzen_0
0,1621542659.0,2021-05-2020:30:59,[ART] A small trivia from a Kentaro Miura Interview and his drawing process.,16592,nhaoi1,16427,manga,165,2021-05-2013:30:59,0,191,
0,1610875133.0,2021-01-1709:18:53,[Art] Aki vs Katana Man (Chainsaw Man),15069,kz3bhu,14919,manga,150,2021-01-1701:18:53,0,166,unknowndarkzane
0,1620260182.0,2021-05-0600:16:22,MangaDex v5 Front End Sneak Peak,14686,n5un19,14540,manga,146,2021-05-0517:16:22,0,439,Wy4m
0,1616364009.0,2021-03-2122:00:09,My grandpa just turned 91. This is his birthday present to himself.,48808,ma79ze,40999,teslamotors,7809,2021-03-2115:00:09,0,1026,andork28
0,1611885465.0,2021-01-2901:57:45,Elon Burn Ouch 🤕,31510,l7fw2f,28359,teslamotors,3151,2021-01-2817:57:45,0,888,carpy987654
0,1622044006.0,2021-05-2615:46:46,"In NYC today: Photos of the new F150 Lightning in the wild. I know this isn't a Tesla, so mods - feel free to take down if not appropriate.",26875,nlk5ii,23382,teslamotors,3493,2021-05-2608:46:46,0,2428,kramdam
0,1614622337.0,2021-03-0118:12:17,Using Tesla app to melt snow & ice off before leaving the house,24196,lvg29g,21293,teslamotors,2903,2021-03-0110:12:17,0,959,skpl
0,1611781753.0,2021-01-2721:09:13,The Brand New Tesla Model S,23873,l6egn1,20531,teslamotors,3342,2021-01-2713:09:13,0,1929,rajkhaitan
0,1609755914.0,2021-01-0410:25:14,Guitarist Alexi Laiho has died at 41.,4376,kq63s0,4376,Metal,0,2021-01-0402:25:14,0,793,RiverFinn
0,1627419205.0,2021-07-2720:53:25,Joey Jordison dead at 46,2736,osuz79,2709,Metal,27,2021-07-2713:53:25,0,487,MoistWalrus
0,1613571328.0,2021-02-1714:15:28,Gojira - Born For One Thing,1946,llvewu,1908,Metal,38,2021-02-1706:15:28,0,218,GuitarFreak027
0,1635437628.0,2021-10-2816:13:48,"I am thrash metal pioneer Gary Holt, AMA!",1177,qhqhe0,1166,Metal,11,2021-10-2809:13:48,0,176,ExodusAMA
0,1624282284.0,2021-06-2113:31:24,The leader of the pagan-melal band Gods Tower is sentenced to three years in a labor camp in Belarus for a comment in which he compared an official to a pig,1164,o4v7lz,1141,Metal,23,2021-06-2106:31:24,0,126,marnatrauny
0,1615312396.0,2021-03-0917:53:16,16 year old me on the far left at a birthday party I wasn’t invited to [2011],63217,m1c1bq,59424,cringepics,3793,2021-03-0909:53:16,0,1914,SeptimiusSeverus_
0,1617289314.0,2021-04-0115:01:54,Man meets his OnlyFans idol... for only $10k,58268,mhx6nu,54190,cringepics,4078,2021-04-0108:01:54,0,5499,drunk-on-juice
0,1609972448.0,2021-01-0622:34:08,aged like an egg left under a moldy carpet for 3 years 😬😬😬,56388,kryz3a,50750,cringepics,5638,2021-01-0614:34:08,0,1002,loggyloggyloggy
0,1628507425.0,2021-08-0911:10:25,Cartoon porn has corrupted the children,35207,p0zcgm,32391,cringepics,2816,2021-08-0904:10:25,0,573,B34TBOXX5
0,1626863872.0,2021-07-2110:37:52,Girl what… ☠️ the level of narcissism and complete lack of self awareness I genuinely don’t know how people get like this,31607,oon9tb,30027,cringepics,1580,2021-07-2103:37:52,0,487,G09EO4
0,1621001034.0,2021-05-1414:03:54,Jesus Christ. What an idiot.,52079,nc9da1,46351,thatHappened,5728,2021-05-1407:03:54,0,1398,or_gasm
0,1612432483.0,2021-02-0409:54:43,Her jaw dropped,48823,lccfdo,43941,thatHappened,4882,2021-02-0401:54:43,0,2075,K1ngHutch
0,1621064201.0,2021-05-1507:36:41,Oh yeah. For sure.,43706,nctavf,38899,thatHappened,4807,2021-05-1500:36:41,0,1503,griffonbrioche
0,1606319009.0,2020-11-2515:43:29,Everyone’s worst nightmare,41628,k0ufwg,38298,thatHappened,3330,2020-11-2507:43:29,0,1331,sam_babs
0,1612099853.0,2021-01-3113:30:53,Not really sure what is there to brag about anyways,40335,l9cbsk,37915,thatHappened,2420,2021-01-3105:30:53,0,563,-Lanius-
0,1624801568.0,2021-06-2713:46:08,Unlimited Power!,13504,o8xdp5,13099,KerbalSpaceProgram,405,2021-06-2706:46:08,0,367,ksp_HoDeok
0,1632057147.0,2021-09-1913:12:27,AIRPLAAAAAAANE,8067,pr7of2,7906,KerbalSpaceProgram,161,2021-09-1906:12:27,0,182,ksp_HoDeok
0,1624632621.0,2021-06-2514:50:21,"I know that such a network is not very practical, but each satellite in it has a geosynchronous orbit with an inclination of 69%",7594,o7p84p,7443,KerbalSpaceProgram,151,2021-06-2507:50:21,0,364,Pandiwe
0,1606606430.0,2020-11-2823:33:50,This is getting out of hand,7369,k2y9q1,7222,KerbalSpaceProgram,147,2020-11-2815:33:50,0,101,falkihr
0,1624241101.0,2021-06-2102:05:01,The Circle Of Life [Stock + DLC],7128,o4kjwg,7057,KerbalSpaceProgram,71,2021-06-2019:05:01,0,267,JamieLoganAerospace
0,1612864800.0,2021-02-0910:00:00,Think I pissed off my OBGYN 😂,11464,lfz8zl,11464,childfree,0,2021-02-0902:00:00,0,544,LaLaLaaaNotListening
0,1610878348.0,2021-01-1710:12:28,"happy birthday to our childfree queen betty white, who so elegantly stated “the only problem with children is they grow up to be people and i just like animals better than people. it’s that simple.”",10819,kz3xgl,10819,childfree,0,2021-01-1702:12:28,0,189,arawendo
0,1621973038.0,2021-05-2520:03:58,I spent 9k on a vacation and my breeder cousin called me disgusting,11161,nkypw2,10492,childfree,669,2021-05-2513:03:58,0,785,operajunkie
0,1620839119.0,2021-05-1217:05:19,Not having the abortion is the biggest regret of my life,10453,natrcb,10349,childfree,104,2021-05-1210:05:19,0,551,throwawayregret1990
0,1605967957.0,2020-11-2114:12:37,"If you don't have kids, your 30's will basically be like your 20's, but with money.",10267,jybdcd,10165,childfree,102,2020-11-2106:12:37,0,466,ThorsHelm
0,1609845347.0,2021-01-0511:15:47,Don't throw that block!,109488,kqwhfc,105109,perfectlycutscreams,4379,2021-01-0503:15:47,0,845,iwilson57
0,1616123888.0,2021-03-1903:18:08,What the f*ck is Zoom?,90667,m881jr,85227,perfectlycutscreams,5440,2021-03-1820:18:08,0,1723,inthe415
0,1609479989.0,2021-01-0105:46:29,"Anna meets Will Smith, live-2020",87687,ko61e2,85057,perfectlycutscreams,2630,2020-12-3121:46:29,0,503,Neehigh
0,1624708949.0,2021-06-2612:02:29,Little Guy,87291,o89hik,82054,perfectlycutscreams,5237,2021-06-2605:02:29,0,2478,Begin_Trials
0,1615412527.0,2021-03-1021:42:07,The Strength is in the Sushi,81545,m29jf6,79099,perfectlycutscreams,2446,2021-03-1013:42:07,0,455,LilAFromTheBlock
0,1606760154.0,2020-11-3018:15:54,My hotel room in Japan [OC] [3875x2905],30810,k41j1x,29578,RoomPorn,1232,2020-11-3010:15:54,0,409,icywoodz
0,1614991412.0,2021-03-0600:43:32,"This stunning dark bedroom design in Lviv, Ukraine (more photos in comments) [1440x1725]",23080,lyq52l,22157,RoomPorn,923,2021-03-0516:43:32,0,213,beersjob
0,1611178982.0,2021-01-2021:43:02,Double-height home office library with a fire place [660x990],20567,l1jbgl,19539,RoomPorn,1028,2021-01-2013:43:02,0,414,beejeezP0P
0,1617496772.0,2021-04-0400:39:32,Bathroom with geometric blue tile crawling up the ceiling [1080x1176],17626,mjl8dc,16921,RoomPorn,705,2021-04-0317:39:32,0,183,beersjob
0,1615324622.0,2021-03-0921:17:02,A minimalist hotel room in the mountains of Turkey {design by Selami Bektaş} [4000x4000],15265,m1gke2,14655,RoomPorn,610,2021-03-0913:17:02,0,142,beersjob
0,1609809308.0,2021-01-0501:15:08,B-17 Ball Turret Gunner 👀,5284,kqn0e5,5179,MachinePorn,105,2021-01-0417:15:08,0,355,intergalactickomic
0,1611190513.0,2021-01-2100:55:13,"The smallest active-duty vessel of the United States Navy, the Mini Tug.",4935,l1n5yn,4837,MachinePorn,98,2021-01-2016:55:13,0,184,_SP3CT3R
0,1608900765.0,2020-12-2512:52:45,Equipment for the construction of parabolic-shaped banked curves,4067,kjykpy,4027,MachinePorn,40,2020-12-2504:52:45,0,97,_SP3CT3R
0,1622444911.0,2021-05-3107:08:31,Machine gun belt loader,4072,noxazu,3991,MachinePorn,81,2021-05-3100:08:31,0,120,silvercatbob
0,1611016106.0,2021-01-1900:28:26,"Battleship USS Wisconsin towering over the streets of Norfolk, Virginia. [940x1144]",3920,l07tnm,3842,MachinePorn,78,2021-01-1816:28:26,0,78,_SP3CT3R
0,1632062482.0,2021-09-1914:41:22,[PSA] Don't Kill Your Players,2286,pr9706,2104,rpg,182,2021-09-1907:41:22,0,149,Calliophage
0,1606543722.0,2020-11-2806:08:42,"I ""meet"" a friend who died years ago through his old sheet",1630,k2il4g,1598,rpg,32,2020-11-2722:08:42,0,168,AngCF
0,1634234602.0,2021-10-1418:03:22,Paizo Employees Unionize -- United Paizo Workers,1618,q856fk,1570,rpg,48,2021-10-1411:03:22,0,269,Lazy_Flux
0,1613653366.0,2021-02-1813:02:46,"REMINDER: Just because this sub dislikes D&D doesn't mean you should avoid it. In fact, it's a good RPG to get started with!",1507,lmmasq,1266,rpg,241,2021-02-1805:02:46,0,730,dalenacio
0,1611142031.0,2021-01-2011:27:11,"I have almost 400 pieces of music that are free to use and very popular in the RPG, tabletop and DnD community!",1188,l17dh7,1165,rpg,23,2021-01-2003:27:11,0,56,Serpentsoundstudios
0,1609976180.0,2021-01-0623:36:20,META: Today's sedition at the United States Capitol is something unprecedented in American history,66790,ks082p,56772,AskHistorians,10018,2021-01-0615:36:20,0,684,indyobserver
0,1629927004.0,2021-08-2521:30:04,[X-Post] Reddit's unwillingness to properly contain COVID-19 misinformation is part of a broad trend of inadequate action by the Admins against bad faith actors. We stand with our fellow mod teams in calling on reddit to improve.,45905,pbkwye,33970,AskHistorians,11935,2021-08-2514:30:04,0,1,Georgy_K_Zhukov
0,1609221666.0,2020-12-2906:01:06,Is it possible with ancient cultures that we are falsely misled to think they took their beliefs entirely seriously? I.E similar to someone in 3000 years discovering all our Santa decor...,20827,km8hhn,19578,AskHistorians,1249,2020-12-2822:01:06,0,352,Powder9
0,1614028993.0,2021-02-2221:23:13,"Black Panther members once openly carried firearms and would stand nearby when the police pulled over a black person. They would shout advice, like the fact that the person could remain silent, and assured them that they'd be there to help if anything went wrong. Why did this stop?",17778,lq0c4b,16356,AskHistorians,1422,2021-02-2213:23:13,0,395,RusticBohemian
0,1618157148.0,2021-04-1116:05:48,Why do boomers hate their wives?,15262,motghu,13278,AskHistorians,1984,2021-04-1109:05:48,0,234,Frigorifico
0,1608840354.0,2020-12-2420:05:54,"For right handed, left eye dominant folks.",78662,kjluii,70796,specializedtools,7866,2020-12-2412:05:54,0,2769,robblokkit
0,1607794980.0,2020-12-1217:43:00,Chain connector,62792,kbt8ku,59653,specializedtools,3139,2020-12-1209:43:00,0,1061,aloofloofah
0,1621451867.0,2021-05-1919:17:47,Curb shaper,56736,ngegaw,53900,specializedtools,2836,2021-05-1912:17:47,0,892,Boojibs
0,1617648157.0,2021-04-0518:42:37,Refueling helicopter in mid-air! [by jolly_pilot],56451,mkrp0m,53629,specializedtools,2822,2021-04-0511:42:37,0,1705,mtimetraveller
0,1606497975.0,2020-11-2717:26:15,Tool that allows one man to move the whole train by hand,55984,k25ez7,52625,specializedtools,3359,2020-11-2709:26:15,0,1395,aloofloofah
0,1606448208.0,2020-11-2703:36:48,Today I was reminded why I don’t post photos of myself on social media,48648,k1tloa,45730,niceguys,2918,2020-11-2619:36:48,0,1583,
0,1612009537.0,2021-01-3012:25:37,it’s the hat y’all,40968,l8knk7,38510,niceguys,2458,2021-01-3004:25:37,0,498,Writer_novelist
0,1628635522.0,2021-08-1022:45:22,"As requested! Same guy, same conversation.",35893,p2074e,33381,niceguys,2512,2021-08-1015:45:22,0,1897,messyjessie13
0,1614136439.0,2021-02-2403:13:59,"""God we could have worked out too""",31688,lr28jd,29787,niceguys,1901,2021-02-2319:13:59,0,1675,cccamtheman
0,1606061056.0,2020-11-2216:04:16,Saw this post by The Hard Times and immediately thought of this sub.,29932,jyy05a,28436,niceguys,1496,2020-11-2208:04:16,0,605,sincewedidthedo
0,1621823512.0,2021-05-2402:31:52,like the way i ride ?,18271,njnil0,18089,nsfwhardcore,182,2021-05-2319:31:52,0,213,wetkitty_of
0,1613740392.0,2021-02-1913:13:12,TTP RWT 05,14309,lnfjek,14023,nsfwhardcore,286,2021-02-1905:13:12,0,102,ChaoticsChanel
0,1615964868.0,2021-03-1707:07:48,my pussy loves a hard pounding 😁 (OC),13000,m6ujy0,12870,nsfwhardcore,130,2021-03-1700:07:48,0,99,stellavioletxx
0,1627820671.0,2021-08-0112:24:31,Bend me over the counter and use me as you please,12580,ovr6ty,12455,nsfwhardcore,125,2021-08-0105:24:31,0,250,LewisandLucy
0,1633038272.0,2021-09-3021:44:32,Strip club in Mexico,12009,pytnda,11769,nsfwhardcore,240,2021-09-3014:44:32,0,224,Huge-Top-35
