image_id,unixtime,rawtime,title,total_votes,reddit_id,number_of_upvotes,subreddit,number_of_downvotes,localtime,score,number_of_comments,username
0,1609159248.0,2020-12-2812:40:48,"my local county went into tier 3 lockdown meaning restaurants have to close, no staff member went home empty handed",15465,klpu99,15002,MealPrepSunday,463,2020-12-2804:40:48,0,253,mini-jeckyl
0,1615819910.0,2021-03-1514:51:50,No need to complicate things,12365,m5mcy2,11747,MealPrepSunday,618,2021-03-1507:51:50,0,256,mjomark
0,1611585612.0,2021-01-2514:40:12,Cup o noodles just add hot water,10336,l4p3z6,10130,MealPrepSunday,206,2021-01-2506:40:12,0,216,luwandaattheOHclub
0,1606420840.0,2020-11-2620:00:40,My meal prep by my gf. Second pic is when we have a fight 🤣.,9894,k1m8kw,9301,MealPrepSunday,593,2020-11-2612:00:40,0,212,Illustrious_West_976
0,1607967352.0,2020-12-1417:35:52,“We have Chipotle at Home.”,9317,kd2712,9038,MealPrepSunday,279,2020-12-1409:35:52,0,166,wipe_frnt_2_bak
0,1609825381.0,2021-01-0505:43:01,Guy attempts to steal package but gets caught. When he drives away his car gets stuck in snow,97981,kqrr2j,94062,instantkarma,3919,2021-01-0421:43:01,0,3649,froyoboyz
0,1611593317.0,2021-01-2516:48:37,"Guy shoots himself in the leg, trying to break into a house",82240,l4rs8q,78951,instantkarma,3289,2021-01-2508:48:37,0,3303,AristonD
0,1619128885.0,2021-04-2222:01:25,"Road raging Camry fake swerves into Hyundai but over-corrects, crashing into barrier",74253,mwg1ha,72026,instantkarma,2227,2021-04-2215:01:25,0,2631,YanCantCook
0,1621896241.0,2021-05-2422:44:01,"Road Rage karma in Sunny Scottsdale, AZ",68005,nkaixb,64605,instantkarma,3400,2021-05-2415:44:01,0,2949,Dr_Zol_Epstein_III
0,1625192089.0,2021-07-0202:14:49,Gangbanger wannabe,66830,oc0o95,62152,instantkarma,4678,2021-07-0119:14:49,0,1729,Familiar_Big3322
0,1617313659.0,2021-04-0121:47:39,That's really hot.,45081,mi5w1w,44180,hentai,901,2021-04-0114:47:39,0,398,Alcatraz1331
0,1624374133.0,2021-06-2215:02:13,It does not teleport clothes,42848,o5p6lc,42420,hentai,428,2021-06-2208:02:13,0,664,Draknalor
0,1610960586.0,2021-01-1809:03:06,Thighjob on the train,40641,kzr2az,40235,hentai,406,2021-01-1801:03:06,0,434,
0,1609466379.0,2021-01-0101:59:39,Come to my office I have a surprise for you,37700,ko2wkg,36946,hentai,754,2020-12-3117:59:39,0,244,EverWell0220
0,1618855392.0,2021-04-1918:03:12,Stressing about how to handle them all,37000,mu6irs,36630,hentai,370,2021-04-1911:03:12,0,601,Tonystxrk2321
0,1622993827.0,2021-06-0615:37:07,"A Viking era ring inscribed with the words 'for Allah', found in the grave of a woman who was buried 1200 years ago in Birka, 25 km west of modern-day Stockholm. The ring constitutes a unique material evidence of direct contact between the Vikings and the Abbasid Caliphate [2000x1357]",27180,ntofgp,26093,ArtefactPorn,1087,2021-06-0608:37:07,0,667,Fuckoff555
0,1633374784.0,2021-10-0419:13:04,"The Swedish warship Vasa. It sank in 1628 less than a mile into its maiden voyage and was recovered from the sea floor after 333 years almost completely intact. Now housed at the Vasa Museum in Stockholm, is the world's best preserved 17th century ship [1994x2048]",18638,q1cmer,18266,ArtefactPorn,372,2021-10-0412:13:04,0,486,Fuckoff555
0,1610455364.0,2021-01-1212:42:44,9000 year old cave painting in Tassili cave Algeria . Depicting a shaman during psychedelic mushroom use. (890x 632),16765,kvqy59,16263,ArtefactPorn,502,2021-01-1204:42:44,0,484,gillbeats
0,1624010680.0,2021-06-1810:04:40,"The 4000-year-old skeletons of a mother who was trying to shield her child from a massive earthquake that struck China in 2000 BC and triggered massive floods, in an event that is sometimes referred to as ‘China’s Pompeii’. Now located at the Lajia Ruins Museum in northwest China [1200x798]",14546,o2lmhr,14256,ArtefactPorn,290,2021-06-1803:04:40,0,277,Fuckoff555
0,1625845871.0,2021-07-0915:51:11,"An early example of a successful cranioplasty (Peru, ca. 400 CE). The patient survived, as evidenced by the well-healed in situ cranioplasty made from a gold inlay. Now on display at the Gold Museum of Peru and Weapons of the World in Lima [1200x1448]",14123,ogyegz,13841,ArtefactPorn,282,2021-07-0908:51:11,0,446,Fuckoff555
0,1614352585.0,2021-02-2615:16:25,Remakes of Pokémon Diamond & Pearl; Pokémon Brilliant Diamond & Shining Pearl have been announced for release this year.,14832,lszqto,13794,nintendo,1038,2021-02-2607:16:25,0,1224,
0,1608407287.0,2020-12-1919:48:07,"Man mails in Wii U for repair, Nintendo mails back his wedding ring that was inside it",12495,kgeua5,12121,nintendo,374,2020-12-1911:48:07,0,223,Johnetcetc
0,1634995233.0,2021-10-2313:20:33,Charles Martinet: ‘‘I want to voice Mario until I drop dead.’’,12367,qe4to8,11996,nintendo,371,2021-10-2306:20:33,0,463,Brosbrawls
0,1612012358.0,2021-01-3013:12:38,"Reggie Admits Switch Was A ""Make Or Break Product"" For Nintendo After Poor Performance Of Wii U",11691,l8lfea,11341,nintendo,350,2021-01-3005:12:38,0,662,Riomegon
0,1637068730.0,2021-11-1613:18:50,"Happy 69th Birthday to Nintendo legend, Shigeru Miyamoto!",10205,qv7lj5,9797,nintendo,408,2021-11-1605:18:50,0,696,tepid
0,1627866084.0,2021-08-0201:01:24,Orangutan puts on sunglasses,125255,ow4cgq,110225,likeus,15030,2021-08-0118:01:24,0,2481,izzyg800
0,1620956288.0,2021-05-1401:38:08,He's a little too smart,67195,nbx8ps,63164,likeus,4031,2021-05-1318:38:08,0,550,My_Memes_Will_Cure_U
0,1622279584.0,2021-05-2909:13:04,Dog recognises and helps stop friend's seizure,57836,nnjk7s,54366,likeus,3470,2021-05-2902:13:04,0,758,aloofloofah
0,1625909063.0,2021-07-1009:24:23,Singing birb,39764,ohfjqv,38174,likeus,1590,2021-07-1002:24:23,0,390,My_Memes_Will_Cure_U
0,1630076353.0,2021-08-2714:59:13,"Dog knows how to use the crosswalk, but not press the button. Cars stop for him anyways.",39350,pcp0wy,36596,likeus,2754,2021-08-2707:59:13,0,342,5_Frog_Margin
0,1610502690.0,2021-01-1301:51:30,"I think until basic nutrition is not taught in schools, obesity as a public health issue will never go away.",2594,kw68ae,2491,nutrition,103,2021-01-1217:51:30,0,331,mayermail1977
0,1622054429.0,2021-05-2618:40:29,The food system in America is rigged and is legitimately an abomination to Humankind!,1552,nlo73i,1490,nutrition,62,2021-05-2611:40:29,0,383,
0,1630686334.0,2021-09-0316:25:34,WHY ARE THERR SO MANY JUNK FOOD RESTAURANTS AND HARDLY ANY HEALTHY ESTABLISHMENTS??,1193,ph8jy4,1062,nutrition,131,2021-09-0309:25:34,0,346,BlessedAF777
0,1631368318.0,2021-09-1113:51:58,Isn’t it weird that most people are overweight in the US?,1068,pm7t0s,940,nutrition,128,2021-09-1106:51:58,0,633,epooqeo
0,1607625555.0,2020-12-1018:39:15,"Is this a placebo, or is ginger tea really this amazing?",901,kal4h7,883,nutrition,18,2020-12-1010:39:15,0,194,
0,1622720272.0,2021-06-0311:37:52,"If you ever feel bad about your storyboard drawings, here is what Rian Johnson drew for Knives Out.",12730,nrbc3h,12349,Filmmakers,381,2021-06-0304:37:52,0,245,AnonDooDoo
0,1607789128.0,2020-12-1216:05:28,BTS of my first one-shot commercial,12436,kbrizp,12063,Filmmakers,373,2020-12-1208:05:28,0,281,belarus_guy
0,1628296009.0,2021-08-0700:26:49,Matt Damon explains why they don't make movies like they used to,6666,ozj2ov,6533,Filmmakers,133,2021-08-0617:26:49,0,510,itzyyeji4life
0,1616607601.0,2021-03-2417:40:01,Here's the poster of my new movie!,6243,mcbppn,6056,Filmmakers,187,2021-03-2410:40:01,0,281,mysteryguitarm
0,1635945647.0,2021-11-0313:20:47,Before & After Rain FX - Would love to hear your thoughts!,5778,qlubj1,5663,Filmmakers,115,2021-11-0306:20:47,0,306,Onemightymoose
0,1607772569.0,2020-12-1211:29:29,Fact check ....,145846,kbno6l,115219,insanepeoplefacebook,30627,2020-12-1203:29:29,0,1644,My_Memes_Will_Cure_U
0,1606579244.0,2020-11-2816:00:44,“This is how it feels to be a white conservative”,120382,k2q1xq,97510,insanepeoplefacebook,22872,2020-11-2808:00:44,0,871,asianj1m
0,1605954760.0,2020-11-2110:32:40,Pro-lifer,105411,jy8ouf,89600,insanepeoplefacebook,15811,2020-11-2102:32:40,0,2791,saoghaltagb
0,1606158587.0,2020-11-2319:09:47,How ironic...,95274,jzo50h,82889,insanepeoplefacebook,12385,2020-11-2311:09:47,0,1310,Puffthecarrier1
0,1607433007.0,2020-12-0813:10:07,"Source: ""Trust me bro""",95815,k93vuz,81443,insanepeoplefacebook,14372,2020-12-0805:10:07,0,2512,Nikolaus_Schmand
0,1628506837.0,2021-08-0911:00:37,Anyone else quit Joe Rogan?,1408,p0z7nx,1268,podcasts,140,2021-08-0904:00:37,0,526,pardashrike
0,1634581052.0,2021-10-1818:17:32,"I love podcasts. But if a podcast goes exclusive on Spotify I refuse to continue to listen.i don't care that it's free, I want all my podcasts in one RSS fee and I don't see why I should have to patronize a giant company for a podcast. I'd rather directly support creators. Thoughts?",1038,qasj65,955,podcasts,83,2021-10-1811:17:32,0,251,careysue
0,1629916700.0,2021-08-2518:38:20,"The Verge: ""Joe Rogan, confined to Spotify, is losing influence""",798,pbheul,759,podcasts,39,2021-08-2511:38:20,0,392,TheTim
0,1610151101.0,2021-01-0900:11:41,I am done with this subreddit,812,ktfi4l,756,podcasts,56,2021-01-0816:11:41,0,70,princess_naive
0,1616697695.0,2021-03-2518:41:35,Anybody else’s wife listen to way to many murder podcasts?,686,md57si,632,podcasts,54,2021-03-2511:41:35,0,175,OGSoulSlayer
0,1612133413.0,2021-01-3122:50:13,I love Jimmy Woo,120554,l9o8sj,109705,marvelstudios,10849,2021-01-3114:50:13,0,2070,katatoe69
0,1630966716.0,2021-09-0622:18:36,Simu Liu celebrates Shang-Chi and the Legend of the Ten Ring's record breaking opening weekend box office gross,112228,pj9wf8,97639,marvelstudios,14589,2021-09-0615:18:36,0,1815,chanma50
0,1621904876.0,2021-05-2501:07:56,Chris Hemsworth's post about his son's favorite superhero,104580,nkddhn,96214,marvelstudios,8366,2021-05-2418:07:56,0,4107,nickromanoff
0,1623942643.0,2021-06-1715:10:43,"Today is an exciting day for me. My artwork has been officially licensed by Marvel! (Iron Man, Cap, Thor trilogy posters)",91927,o1zjus,84573,marvelstudios,7354,2021-06-1708:10:43,0,1637,NautilusD
0,1627899640.0,2021-08-0210:20:40,James Gunn is NOT happy about this comment,87284,owboir,78556,marvelstudios,8728,2021-08-0203:20:40,0,3501,MarvelNoob69
0,1634438880.0,2021-10-1702:48:00,Saw this through the window of a small business lol default SSID and password exposed for the world to see lol. Human error will keep us white hats employed 😁,2680,q9q84f,2573,hacking,107,2021-10-1619:48:00,0,123,Diametrical_Duck
0,1620624910.0,2021-05-1005:35:10,My dad passed away a couple of weeks ago and he left behind a letter to me in a locked .dmg file…,2472,n8wwoo,2448,hacking,24,2021-05-0922:35:10,0,199,madm4x
0,1615900204.0,2021-03-1613:10:04,"This person reverse engineered the GTA Online loading mechanism, reduced load times by about 70% and now got rewarded 10k$ by Rockstar. Brilliant application of security techniques in a non-security context!",2304,m68pe7,2281,hacking,23,2021-03-1606:10:04,0,60,Goforhistory
0,1623872658.0,2021-06-1619:44:18,Quality Post,2189,o1dkk6,2080,hacking,109,2021-06-1612:44:18,0,26,urbanscouter
0,1629911416.0,2021-08-2517:10:16,Using an arduino pro micro to exploit a bug in razer's synapse driver,1728,pbfme3,1711,hacking,17,2021-08-2510:10:16,0,69,zebrazookeeper
0,1617908844.0,2021-04-0819:07:24,Plastic is the new paper!,125203,mmyzwu,120195,assholedesign,5008,2021-04-0812:07:24,0,1671,SPLICER55
0,1615853578.0,2021-03-1600:12:58,"Chipotle goes all-out advertising that for the next week delivery is free, and then casually makes the delivery menu priced higher than the regular one.",95768,m5w095,90980,assholedesign,4788,2021-03-1517:12:58,0,2735,Arucious
0,1628345772.0,2021-08-0714:16:12,having to watch 30 seconds of ads before i'm even able to use the gas pump WTF,86420,ozu1up,81235,assholedesign,5185,2021-08-0707:16:12,0,4553,PlasticRice
0,1612707588.0,2021-02-0714:19:48,AH station Design,87944,lenb0r,77391,assholedesign,10553,2021-02-0706:19:48,0,2061,masteromatic
0,1619603694.0,2021-04-2809:54:54,"My age preferences are there for a reason, Tinder...",80820,n0bby5,76779,assholedesign,4041,2021-04-2802:54:54,0,1744,AppleSlize
0,1609449799.0,2020-12-3121:23:19,MF DOOM has passed away,5508,knydhn,5453,indieheads,55,2020-12-3113:23:19,0,276,ReconEG
0,1612002165.0,2021-01-3010:22:45,SOPHIE has passed away at 34.,5490,l8it4o,5436,indieheads,54,2021-01-3002:22:45,0,293,LoneBell
0,1624636767.0,2021-06-2515:59:27,Isaac from Modest Mouse here. Ask me anything! I’ll be back at 2p ET to answer. The new album The Golden Casket is out now. You can listen and buy the album here: https://modestmouse.lnk.to/TheGoldenCasket US tour begins July 30th. Get tickets now at https://www.modestmouse.com/#tour,4866,o7qkj9,4623,indieheads,243,2021-06-2508:59:27,0,1007,ModestMouseMusic
0,1612787976.0,2021-02-0812:39:36,"Congrats Oneohtrix Point Never, musical director of The Weeknd’s halftime show",4663,lfaye5,4524,indieheads,139,2021-02-0804:39:36,0,204,TheTwitteringMachine
0,1614896103.0,2021-03-0422:15:03,[FRESH PERFORMANCE] The Wiggles - Elephant (Tame Impala cover for 'Like a Version'),4165,lxwx7n,4124,indieheads,41,2021-03-0414:15:03,0,225,thewickerstan
0,1623984470.0,2021-06-1802:47:50,"My Ideal Dream Homestead, about 8-10 heavily wooded acres with about two acres in the center cleared and a winding driveway so no one can see past the driveway gate leading in.",7337,o2erp0,7191,homestead,146,2021-06-1719:47:50,0,410,SoloWarhead
0,1612806436.0,2021-02-0817:47:16,I'm so proud of what my Pop grows in his garden,6812,lfha30,6676,homestead,136,2021-02-0809:47:16,0,126,AcadianHunter
0,1625318220.0,2021-07-0313:17:00,As requested: my ram raming his toy,6543,ocxw6i,6478,homestead,65,2021-07-0306:17:00,0,214,zerohero42
0,1623846024.0,2021-06-1612:20:24,Blackberries are super easy to Grow,6558,o13k9g,6296,homestead,262,2021-06-1605:20:24,0,310,ProlificFamilyStead
0,1609108452.0,2020-12-2722:34:12,"I posted 4 years ago about my kiddo splitting wood. It is still his favorite chore at 10, and he is quite good at it",6153,kld3ik,6030,homestead,123,2020-12-2714:34:12,0,281,eloquinee
0,1627261150.0,2021-07-2600:59:10,Found in the wild: How I feel about the misappropriation of the Punisher logo,39904,oro4e7,34717,comicbooks,5187,2021-07-2517:59:10,0,703,Obliterature
0,1624326304.0,2021-06-2201:45:04,I Opened a comic shop 2 years ago in Ontario. Still going strong!,9848,o5b99l,9553,comicbooks,295,2021-06-2118:45:04,0,271,thecanadiancomicbin
0,1612364418.0,2021-02-0315:00:18,Cyclops summed up in 2 panels [Uncanny X-Men #541],8685,lbpcue,8512,comicbooks,173,2021-02-0307:00:18,0,325,Mnemosense
0,1631445181.0,2021-09-1211:13:01,Tobey Maguire and Sam Raimi consulting an Ultimate Spider-Man comic while shooting for Spider-Man. (c.2001),8615,pmqu78,8443,comicbooks,172,2021-09-1204:13:01,0,203,That_Quarter_3674
0,1622017548.0,2021-05-2608:25:48,This panel hurts so much (ASM #605),8874,nlbusk,8431,comicbooks,443,2021-05-2601:25:48,0,411,Independent-War8588
0,1608125252.0,2020-12-1613:27:32,[/r/NSFW_5seconds] Riding him till creampie,15518,ke95oi,15363,porn,155,2020-12-1605:27:32,0,309,crosspostninja
0,1618757761.0,2021-04-1814:56:01,[/r/TitsandAssLovers] Truly perfection,13394,mtecfp,13261,porn,133,2021-04-1807:56:01,0,330,Wafflecakes10
0,1626159900.0,2021-07-1307:05:00,[/r/BestAmateurGirls] She loves working under me,13338,ojabd4,13205,porn,133,2021-07-1300:05:00,0,415,Apka_Desi_Mod
0,1621762420.0,2021-05-2309:33:40,[/r/Fuckdoll] Melody getting everything she wants,9954,nj4agv,9855,porn,99,2021-05-2302:33:40,0,159,natejames33
0,1623258229.0,2021-06-0917:03:49,[/r/BestAmateurGirls] Ballsdeep: Jesus she actually did that,9663,nw0slk,9567,porn,96,2021-06-0910:03:49,0,233,Apka_Desi_Mod
0,1629849232.0,2021-08-2423:53:52,Update: Funeral outfit for 12 year old,3246,pazg1i,3214,femalefashionadvice,32,2021-08-2416:53:52,0,117,34786t234890
0,1617647129.0,2021-04-0518:25:29,"An experiment: I bought ""ethical fashion"" for 2 years to see if the average person can afford it.",2805,mkrb94,2665,femalefashionadvice,140,2021-04-0511:25:29,0,429,trulynbdy
0,1633546710.0,2021-10-0618:58:30,Does anyone ever feel insecure about putting effort into your look?,2459,q2qzpv,2435,femalefashionadvice,24,2021-10-0611:58:30,0,228,YourFuseIsFireside
0,1606233424.0,2020-11-2415:57:04,I tried wearing only 10 clothes for 10 days! Here are all my outfits,2416,k07l5f,2392,femalefashionadvice,24,2020-11-2407:57:04,0,163,LNMODO
0,1630371418.0,2021-08-3100:56:58,Is any one excited for fall/winter fashion because it is your preferred fashion season?,2239,pevczg,2195,femalefashionadvice,44,2021-08-3017:56:58,0,279,cometofindyourheart
0,1610317087.0,2021-01-1022:18:07,Before/After - Renovated my tiny room! :),58111,kuoieh,54044,CozyPlaces,4067,2021-01-1014:18:07,0,1007,Schivers
0,1609343753.0,2020-12-3015:55:53,Our home theater on a disaster movie marathon,56568,kn4pzy,49215,CozyPlaces,7353,2020-12-3007:55:53,0,1055,mywholename
0,1632161313.0,2021-09-2018:08:33,My Grandparents’ living room,49313,ps0bvt,46355,CozyPlaces,2958,2021-09-2011:08:33,0,739,JTKSR1
0,1609596521.0,2021-01-0214:08:41,Appreciating winter from the inside.,48737,koy139,45326,CozyPlaces,3411,2021-01-0206:08:41,0,351,HardHatFishy
0,1615480907.0,2021-03-1116:41:47,Summer in my dad’s backyard.,44653,m2uhvj,42867,CozyPlaces,1786,2021-03-1108:41:47,0,454,gooblesmoots
0,1613989777.0,2021-02-2210:29:37,[Other] Zelda Williams having a little fun on twitter.,33368,lpku0a,31366,zelda,2002,2021-02-2202:29:37,0,449,IronLanternGamer
0,1617016640.0,2021-03-2911:17:20,[OC] Olympic archer link,26870,mfn9hn,25258,zelda,1612,2021-03-2904:17:20,0,281,Darr1o
0,1613741166.0,2021-02-1913:26:06,[SS] Nintendo 2011 vs Nintendo 2021,27537,lnfsuw,25059,zelda,2478,2021-02-1905:26:06,0,1343,PsychoHydro
0,1617455620.0,2021-04-0313:13:40,[BotW2] I'm crossing my fingers for March 2022,26801,mj89ie,24925,zelda,1876,2021-04-0306:13:40,0,809,Cheeseburger-Sex
0,1622488142.0,2021-05-3119:09:02,[OC]My last minute Zelda cosplay idea. Took about a week. It was the first time I paper mached anything.,24873,npauuu,23879,zelda,994,2021-05-3112:09:02,0,230,systemofabrowncos
0,1609448604.0,2020-12-3121:03:24,R.I.P MF DOOM,43288,kny16d,42856,hiphopheads,432,2020-12-3113:03:24,0,3008,kingkibc
0,1630238385.0,2021-08-2911:59:45,[FRESH] Kanye West - Donda,27558,pdtyv5,26181,hiphopheads,1377,2021-08-2904:59:45,0,6719,SackyPacky
0,1617984914.0,2021-04-0916:15:14,DMX has died at 50,23770,mnkpk0,23533,hiphopheads,237,2021-04-0909:15:14,0,1490,hypocrisyv4
0,1607662797.0,2020-12-1104:59:57,[FRESH ALBUM] Kid Cudi - Man on The Moon III: The Chosen,14159,kaw6h7,14018,hiphopheads,141,2020-12-1020:59:57,0,2204,TheOddScreen
0,1611418320.0,2021-01-2316:12:00,RIP GOATs,13510,l3evy6,13240,hiphopheads,270,2021-01-2308:12:00,0,272,malikdwd
0,1613681979.0,2021-02-1820:59:39,Perseverance has landed!,12008,lmx2rb,11648,nasa,360,2021-02-1812:59:39,0,349,studio929
0,1611172812.0,2021-01-2020:00:12,Happy Birthday to the Legendary Buzz Aldrin! He turns 91 today!,10445,l1h4ui,10237,nasa,208,2021-01-2012:00:12,0,178,Meatbag96
0,1620592385.0,2021-05-0920:33:05,"Just wanted to celebrate my incredible mom, NASA SOFIA Pilot Liz Ruth! She was the aircraft commander on the flight when they first detected water on the sunlit surface of the Moon. Hope this is okay to post here!",8270,n8mv6e,8022,nasa,248,2021-05-0913:33:05,0,82,ig_gnome_inious
0,1629471880.0,2021-08-2015:04:40,"Everyone puts their pants on, one leg at a time. Meanwhile, astronauts....",7614,p871ev,7386,nasa,228,2021-08-2008:04:40,0,107,reddittor
0,1615757167.0,2021-03-1421:26:07,"These Sister where inspired by the book ""I am Neil Armstrong"" and dressed up as a Lunar Lander and Astronaut!",7153,m54ogl,6939,nasa,214,2021-03-1414:26:07,0,101,
0,1614051884.0,2021-02-2303:44:44,"$1 perogies, 1 epic flip",56795,lq8bq8,53956,shittyfoodporn,2839,2021-02-2219:44:44,0,676,Educational-Waltz417
0,1637103396.0,2021-11-1622:56:36,The Chicken Sandwich I got from Mr Beast Burger today,45216,qvkkam,40695,shittyfoodporn,4521,2021-11-1614:56:36,0,2950,Kingsavage07
0,1625066489.0,2021-06-3015:21:29,"Sandwich my dad likes to eat, raw ground beef with raw onions and white pepper on hard bread.",47703,oazitx,39117,shittyfoodporn,8586,2021-06-3008:21:29,0,4790,GerryDos
0,1623106869.0,2021-06-0723:01:09,"$15 ""grilled"" veggie sub",37905,nuq6kf,36010,shittyfoodporn,1895,2021-06-0716:01:09,0,1587,EmilyKills
0,1617410136.0,2021-04-0300:35:36,"I left my melatonin gummies in my car and they melted together, so to fall asleep I just bite a chunk out.",35318,mixmzk,33906,shittyfoodporn,1412,2021-04-0217:35:36,0,671,brodywm
0,1609211238.0,2020-12-2903:07:18,I got bids from tile setters to do a backsplash for $2000. I ended up doing it myself for under $200.,53293,km5ou3,49563,Frugal,3730,2020-12-2819:07:18,0,1514,jwaltersweathermen
0,1607006418.0,2020-12-0314:40:18,I made shelves using recycled thrift store speakers.,32164,k5ydu6,30235,Frugal,1929,2020-12-0306:40:18,0,642,MuchoGrande
0,1621719070.0,2021-05-2221:31:10,simple cardboard game my wife made to our 2.5yo,19958,nismih,19160,Frugal,798,2021-05-2214:31:10,0,233,bart9h
0,1624500162.0,2021-06-2402:02:42,"I saw how difficult it was for my wife to access the corner cabinet, so I concocted a new design. Patent pending... Lol",14824,o6r8ju,14083,Frugal,741,2021-06-2319:02:42,0,325,daveisit
0,1607220994.0,2020-12-0602:16:34,Some cheap Rit dye made my old backpack look new again.,12141,k7kwzo,11656,Frugal,485,2020-12-0518:16:34,0,259,dogmetal
0,1613652534.0,2021-02-1812:48:54,Some of my recent obsession with red/orange,9159,lmm1g5,8976,Design,183,2021-02-1804:48:54,0,156,geometrieva
0,1634970584.0,2021-10-2306:29:44,This garage door in The Netherlands,7894,qdzfl3,7816,Design,78,2021-10-2223:29:44,0,61,Amsterdamsco
0,1609242324.0,2020-12-2911:45:24,Happy new year,6636,kmcx1c,6238,Design,398,2020-12-2903:45:24,0,60,Ra505
0,1607448560.0,2020-12-0817:29:20,Clever walnuts packaging,4459,k98ktk,4415,Design,44,2020-12-0809:29:20,0,42,TalSh
0,1611823738.0,2021-01-2808:48:58,"Not sure if this is allowed, but a nicely designed ad in my opinion.",4307,l6s34n,4178,Design,129,2021-01-2800:48:58,0,81,GlutenAttack02
0,1607711586.0,2020-12-1118:33:06,"I caught my daughter and her boyfriend having sex and I think I did a good job at *NOT* being the stereotypical, obsessed-with-my-daughter’s-vagina dad",17679,kb8d5z,17326,sex,353,2020-12-1110:33:06,0,548,azianchad
0,1607384062.0,2020-12-0723:34:22,psa for guys: when a girl says she’s about to cum you have to KEEP doing exactly what you’re doing,13263,k8sffb,12866,sex,397,2020-12-0715:34:22,0,591,Entire-Gazelle-3478
0,1612811897.0,2021-02-0819:18:17,A dry/unprepared vagina should be considered the same as a flaccid penis.,12021,lfjdcf,11781,sex,240,2021-02-0811:18:17,0,365,NymeriaBites
0,1614204272.0,2021-02-2422:04:32,I had trouble getting off during BJ until ...,10090,lroau0,9889,sex,201,2021-02-2414:04:32,0,139,blahb666
0,1607536060.0,2020-12-0917:47:40,I’m a principal at a high school and we will start providing free condoms.,9286,k9wm1i,9008,sex,278,2020-12-0909:47:40,0,691,anotherIow
0,1618431812.0,2021-04-1420:23:32,When you’re late to meet friends because you were masturbating 🙈,24228,mqz6nn,23986,LegalTeens,242,2021-04-1413:23:32,0,284,urFavouriteRedhead
0,1621279168.0,2021-05-1719:19:28,I feel like I’m a creative person as I invented this new outfit with just tights,21029,nep6gh,20819,LegalTeens,210,2021-05-1712:19:28,0,186,Queenlivia00
0,1612880884.0,2021-02-0914:28:04,Is that a wand in your pocket or are you just happy to see me?,20073,lg4fpy,19672,LegalTeens,401,2021-02-0906:28:04,0,167,LoverLaci
0,1607014705.0,2020-12-0316:58:25,I thought my pussy looked pretty here🥺👉🏻👈🏻,19642,k612su,19053,LegalTeens,589,2020-12-0308:58:25,0,223,prosexx
0,1608554890.0,2020-12-2112:48:10,Once lockdown ends I'm going to go into full slut mode,17463,khgrfn,16940,LegalTeens,523,2020-12-2104:48:10,0,277,LoverLaci
0,1607642448.0,2020-12-1023:20:48,"Star Wars on Twitter: Hayden Christensen returns as Darth Vader, joining Ewan McGregor in OBI-WAN KENOBI",111401,kaq7yo,104717,StarWars,6684,2020-12-1015:20:48,0,4105,tyler980908
0,1631217978.0,2021-09-0920:06:18,Star Wars: Knights Of The Old Republic REMAKE has been announced!,93618,pl5hyt,84257,StarWars,9361,2021-09-0913:06:18,0,4799,
0,1628088047.0,2021-08-0414:40:47,Mark Hamill on Twitter,78508,oxu3k2,72228,StarWars,6280,2021-08-0407:40:47,0,2290,International_Bat851
0,1610957313.0,2021-01-1808:08:33,Liam Neeson still has his lightsaber from shooting The Phantom Menace,71651,kzqdqb,67352,StarWars,4299,2021-01-1800:08:33,0,1039,p4ul1023
0,1611279100.0,2021-01-2201:31:40,"No matter how much some people dislike Rey, you have to admire how Daisy Ridley gave the role her 100%",91969,l2cwvp,65298,StarWars,26671,2021-01-2117:31:40,0,3976,
0,1614089263.0,2021-02-2314:07:43,Perseverance has a rover family window sticker on her deck.,43572,lqj77d,41830,spaceporn,1742,2021-02-2306:07:43,0,455,itsreallyreallytrue
0,1632586996.0,2021-09-2516:23:16,A supernova explosion that happened in Centaurus A,39660,pva2ct,38471,spaceporn,1189,2021-09-2509:23:16,0,849,stonded
0,1613682033.0,2021-02-1821:00:33,The first Image from the Perseverance Rover,37598,lmx3qm,36095,spaceporn,1503,2021-02-1813:00:33,0,676,superblobby
0,1631370156.0,2021-09-1114:22:36,"28 years ago, Russia cancelled its Buran space shuttle program and abandoned two shuttles in a hangar at the Baikonur Cosmodrome. We hiked 80km across the Kazakhstan desert, mostly at night, to see them up close.",31858,pm8bdl,29628,spaceporn,2230,2021-09-1107:22:36,0,450,chrisluckhardt
0,1614943754.0,2021-03-0511:29:14,Perseverance started moving,30550,ly9vdf,29634,spaceporn,916,2021-03-0503:29:14,0,370,ShawnGreyling
