image_id,unixtime,rawtime,title,total_votes,reddit_id,number_of_upvotes,subreddit,number_of_downvotes,localtime,score,number_of_comments,username
0,1611537714.0,2021-01-2501:21:54,"2 months of design and planning, 3 months of building later, I have the gaming table of my dreams.",9537,l4cm5m,9347,boardgames,190,2021-01-2417:21:54,0,276,AnCyberTurtle
0,1633462147.0,2021-10-0519:29:07,Found the exact spot from the Carcassonne Box!,8701,q23ng1,8527,boardgames,174,2021-10-0512:29:07,0,227,christopherrivers
0,1609892676.0,2021-01-0600:24:36,"Couldn't be happier, finally got a spot for all my games",7933,krbu20,7616,boardgames,317,2021-01-0516:24:36,0,393,SSambraa
0,1612249204.0,2021-02-0207:00:04,I am never playing another board game with my SO's family ever again,7405,lapuf1,7109,boardgames,296,2021-02-0123:00:04,0,1098,themadcaner
0,1613758666.0,2021-02-1918:17:46,1 full minute of my girlfriend falling off the edge in 3D world,62740,lnml5s,56466,NintendoSwitch,6274,2021-02-1910:17:46,0,1514,MajesticRubyWolf
0,1614352965.0,2021-02-2615:22:45,Pokemon Legends Arceus - Reveal Trailer,59751,lszvgs,52581,NintendoSwitch,7170,2021-02-2607:22:45,0,4444,Neyo708
0,1614462731.0,2021-02-2721:52:11,"My girlfriend studies product-design, and she created a Nintendo Switch in 1:1 for university, with detachable Joy-Cons, Docking Station and everything, just out of Paper.",58553,lty7ic,51527,NintendoSwitch,7026,2021-02-2713:52:11,0,630,PandaWalkWithMe
0,1622309422.0,2021-05-2917:30:22,My logo for the rumored new model,54462,nns7zi,49016,NintendoSwitch,5446,2021-05-2910:30:22,0,997,JardsonJean
0,1619793919.0,2021-04-3014:45:19,TIL you can pair a joycon with your phone and use it as a shutter button to take photos remotely.,49511,n1vdbj,46046,NintendoSwitch,3465,2021-04-3007:45:19,0,846,Byotan
0,1611587831.0,2021-01-2515:17:11,Thought this belonged here,5187,l4pu4a,5032,malefashionadvice,155,2021-01-2507:17:11,0,198,311_420_69
0,1618439469.0,2021-04-1422:31:09,Patagonia Will No Longer Add Corporate/Brand Logos,3467,mr1p04,3398,malefashionadvice,69,2021-04-1415:31:09,0,324,zsreport
0,1610392623.0,2021-01-1119:17:03,DIY. Carry-on/weekender leather duffle bag,3322,kv9pja,3256,malefashionadvice,66,2021-01-1111:17:03,0,86,dmootzler
0,1614121225.0,2021-02-2323:00:25,12 Japanese firms will end business deals involving Uighur forced labor (including Uniqlo),3228,lqvnyo,3132,malefashionadvice,96,2021-02-2315:00:25,0,89,TheManFromFairwinds
0,1612104025.0,2021-01-3114:40:25,'Everybody will get their mittens': maker of Bernie Sanders' mittens forges business partnership,3040,l9dj91,2888,malefashionadvice,152,2021-01-3106:40:25,0,137,zsreport
0,1624317581.0,2021-06-2123:19:41,Niantic is REMOVING increased PokeStop and Gym interaction distance. Let them know how removing one of the best features they have ever added is a massive mistake.,36552,o58fbu,34359,pokemongo,2193,2021-06-2116:19:41,0,1524,Amazon_UK
0,1611342338.0,2021-01-2219:05:38,Has anyone got the shiny Bernie yet? My friend caught both. I'm so incredibly jealous. I want the Shiny Bernie,29985,l2ujtw,25188,pokemongo,4797,2021-01-2211:05:38,0,231,sparklymoons
0,1610749013.0,2021-01-1522:16:53,Picked up a new stylus to play PoGo 😹,25612,ky5bxq,24332,pokemongo,1280,2021-01-1514:16:53,0,275,lazyleiz
0,1609005492.0,2020-12-2617:58:12,I don't understand... It's just an ice cream cone,25277,kkmosh,24014,pokemongo,1263,2020-12-2609:58:12,0,434,RashestGecko
0,1610977737.0,2021-01-1813:48:57,"Sorry if this is a repost, my friend showed me this pic and i thought it was funny",23008,kzuz6b,22088,pokemongo,920,2021-01-1805:48:57,0,173,-halfbloodprince-
0,1627204220.0,2021-07-2509:10:20,ITAP of my girlfriend doing homework in NYC.,50270,or8bob,44238,itookapicture,6032,2021-07-2502:10:20,0,946,That-Donkey
0,1616584878.0,2021-03-2411:21:18,ITAP of both sides of a neon sign in NYC,44770,mc391z,43427,itookapicture,1343,2021-03-2404:21:18,0,378,viciousdv
0,1629003001.0,2021-08-1504:50:01,ITAP of my wife and curious son in the rain.,38604,p4n6dv,35902,itookapicture,2702,2021-08-1421:50:01,0,409,alittlebrock
0,1626028654.0,2021-07-1118:37:34,ITAP of a stoRAGE building,34242,oi9zfa,32873,itookapicture,1369,2021-07-1111:37:34,0,396,matts1320
0,1615741019.0,2021-03-1416:56:59,ITAP of train tracks at sunset,32318,m4yw22,31026,itookapicture,1292,2021-03-1409:56:59,0,347,Rose7pt
0,1606400583.0,2020-11-2614:23:03,Scrollsawn project with all natural woods (no stains or dyes). Prince John and Hiss from Robin Hood. Oodalally!!,64946,k1g197,61699,woodworking,3247,2020-11-2606:23:03,0,1005,woodland_porpoise
0,1613933208.0,2021-02-2118:46:48,"Imagine the look on my face when my boss said “you’ll be lead carpenter on this stair job” when I had never made a single tread before. Lots of work by lots of people, I can’t take all the credit, but damn if I didn’t pour my blood and sweat into this staircase.",62644,lp3mtu,60139,woodworking,2505,2021-02-2110:46:48,0,1184,Dangnamit
0,1632787333.0,2021-09-2800:02:13,"My wife wanted new cabinets for the laundry room. Instead of going to Ikea, I spent 6 months and double the money building these.",53314,pwtyvp,50649,woodworking,2665,2021-09-2717:02:13,0,1216,Ginger-Engineer
0,1616516056.0,2021-03-2316:14:16,"Been lurking here a long time, quit my job as a software developer about six months ago because I hated sitting at a desk all day. Started woodworking full time, this was my first major job, finally finished.",52622,mbi976,49991,woodworking,2631,2021-03-2309:14:16,0,1273,Bothwell_design
0,1617191053.0,2021-03-3111:44:13,First violin is finished!,44298,mh4b2j,41641,woodworking,2657,2021-03-3104:44:13,0,855,Ruvidman
0,1608736787.0,2020-12-2315:19:47,Let's appreciate Apple for making distinctive and instantly recognizable app icons unlike Google,27952,kiuwnm,22921,iphone,5031,2020-12-2307:19:47,0,1033,izenil03
0,1608982031.0,2020-12-2611:27:11,Christmas present me and my brother made for our dad showcasing the first iPhone that he ever had,14973,kkh662,13776,iphone,1197,2020-12-2603:27:11,0,327,achisto
0,1627509354.0,2021-07-2821:55:54,Who else does this bother?,14501,otk052,13196,iphone,1305,2021-07-2814:55:54,0,570,ocdpc
0,1611445369.0,2021-01-2323:42:49,Reddit’s reaction to the first iPhone in 2007,8771,l3nkfw,8421,iphone,350,2021-01-2315:42:49,0,835,Apple_The_Chicken
0,1606334842.0,2020-11-2520:07:22,Best part of working in radiology is using my iPhone 12 Pro Max to test the X-ray tube. I figured I’d share the insides! Look at the sensor shift stabilizer around the 3rd camera.,8147,k0zryu,7903,iphone,244,2020-11-2512:07:22,0,267,joshkramer42
0,1620324615.0,2021-05-0618:10:15,"Ohio State Senator, using a Zoom background of his home office while driving, debating a bill for harsher penalties for distracted driving.",178481,n6dlon,173127,IdiotsInCars,5354,2021-05-0611:10:15,0,4630,JDBAZ
0,1619300460.0,2021-04-2421:41:00,"They added a roundabout near my hometown in rural, eastern Kentucky. Here is an example of how NOT to use a roundabout...",152921,mxtoe6,148334,IdiotsInCars,4587,2021-04-2414:41:00,0,10111,EVOSexyBeast
0,1620907803.0,2021-05-1312:10:03,Idiot in Hummer filled 5 gas cans expecting shortages. Put them in his car and lit up a cigarette. Hummer destroyed. Swipe to see gas cans.,134572,nbf59k,127844,IdiotsInCars,6728,2021-05-1305:10:03,0,8299,meister2a
0,1623239476.0,2021-06-0911:51:16,Idiot cop flips pregnant woman's car for pulling over too slowly.,142036,nvtw8w,124992,IdiotsInCars,17044,2021-06-0904:51:16,0,21651,Valkie
0,1621116835.0,2021-05-1522:13:55,So this happened to me today. Gotta love illegal U-turns off of the shoulder,121677,nd9urp,118027,IdiotsInCars,3650,2021-05-1515:13:55,0,4319,That_random_guy-1
0,1625861982.0,2021-07-0920:19:42,How I Video Game after losing My Arm,56462,oh3ssx,52510,xboxone,3952,2021-07-0913:19:42,0,1879,aaron1handedgamer
0,1607350631.0,2020-12-0714:17:11,Xbox Series X Loading Up GTA 5. WOWWWW!!!,49004,k8hdrf,44104,xboxone,4900,2020-12-0706:17:11,0,1581,MrStealKiller
0,1607730473.0,2020-12-1123:47:53,Gave this Fortnite kid the true Halo experience. My work here is done,45080,kbea7p,39220,xboxone,5860,2020-12-1115:47:53,0,896,ProNoobCombo
0,1607029910.0,2020-12-0321:11:50,"Just trying to do my part, y’all.",44738,k66c20,37580,xboxone,7158,2020-12-0313:11:50,0,2554,charliewarner01
0,1609784472.0,2021-01-0418:21:12,"""Which IKEA media storage unit will be able to fit my new, meme-ishly oversized, game console?""",40441,kqeeyr,35993,xboxone,4448,2021-01-0410:21:12,0,1125,xsake1001
0,1612186360.0,2021-02-0113:32:40,"It's fucking awful seeing the ""Silver"" misinformation campaign everywhere I look",113241,la34bh,101917,stocks,11324,2021-02-0105:32:40,0,4353,
0,1611834918.0,2021-01-2811:55:18,Companies try to prevent people from trading GME and AMC,94170,l6uva1,88520,stocks,5650,2021-01-2803:55:18,0,6787,rotloch
0,1611872861.0,2021-01-2822:27:41,Today is a dark day for traders,48217,l7awnp,45324,stocks,2893,2021-01-2814:27:41,0,2575,Ellen_Pirgo
0,1611755641.0,2021-01-2713:54:01,GME Dedicated Thread - Breaking: CNBC engages in market manipulation - lies about Melvin Capital having already covered positions,45617,l64xvw,41968,stocks,3649,2021-01-2705:54:01,0,4934,CriticDanger
0,1612029808.0,2021-01-3018:03:28,Weekend GME Thread + Homework for all: Let's stop using brokerages that halted trading,38364,l8rhr3,36063,stocks,2301,2021-01-3010:03:28,0,4376,CriticDanger
0,1625315782.0,2021-07-0312:36:22,AITA for telling my wife the lock on my daughter's door does not get removed til my brother inlaw and his daughters are out of our house?,86106,ocx94s,79218,AmItheAsshole,6888,2021-07-0305:36:22,0,5324,OnlyInQuebec9
0,1625681504.0,2021-07-0718:11:44,"AITA for ""announcing"" that my dad's not paying my college tuition",57133,ofol5x,50849,AmItheAsshole,6284,2021-07-0711:11:44,0,2884,yeasothat
0,1627647034.0,2021-07-3012:10:34,AITA for refusing to pay for my sister's husband's surgery with my inheritance/college money?,57072,ouje2w,49653,AmItheAsshole,7419,2021-07-3005:10:34,0,6429,Home-Time-6077
0,1626968878.0,2021-07-2215:47:58,[UPDATE] AITA for telling an employee she can choose between demotion or termination?,52515,opgizn,48314,AmItheAsshole,4201,2021-07-2208:47:58,0,2243,Absolut_Failure
0,1624376321.0,2021-06-2215:38:41,"AITA for calling my SIL a racist after she compared my cooking to ""making kung pao chicken""?",48562,o5pzzy,47106,AmItheAsshole,1456,2021-06-2208:38:41,0,1530,throwaway23235982353
0,1633781895.0,2021-10-0912:18:15,Ladies and gentlemen: bike infrastructure in Delft,10887,q4k75z,10561,Outdoors,326,2021-10-0905:18:15,0,716,namiklop
0,1624792868.0,2021-06-2711:21:08,"View from my cabin in Fairy Meadows, Pakistan",7954,o8v81m,7795,Outdoors,159,2021-06-2704:21:08,0,459,Bagarbilla5
0,1611508422.0,2021-01-2417:13:42,Last night's trail cam,8198,l43fk6,7625,Outdoors,573,2021-01-2409:13:42,0,66,CaptainWisconsin
0,1630922647.0,2021-09-0610:04:07,"I hate non-navigational cairns, and I love this sign:",8031,piwj2a,7389,Outdoors,642,2021-09-0603:04:07,0,705,ILikeCrabbyRobots
0,1609512853.0,2021-01-0114:54:13,Journey 😲,7283,kochhs,6992,Outdoors,291,2021-01-0106:54:13,0,321,FrancescaGaliardee
0,1619694064.0,2021-04-2911:01:04,“Ive never found a black woman attractive but I think you’re beautiful”,23268,n11w0t,20011,dating_advice,3257,2021-04-2904:01:04,0,2784,Brittanyaaman_
0,1608292780.0,2020-12-1811:59:40,"LPT: You don't need a 'perfect relationship'. All you need is someone who loves your weirdness, wants to spend time with you, and respects you.",15729,kfjts0,14943,dating_advice,786,2020-12-1803:59:40,0,573,nfhii
0,1624973669.0,2021-06-2913:34:29,“Can I give you my number?” instead of “Can I get your number?”,13805,oa8e6a,12563,dating_advice,1242,2021-06-2906:34:29,0,1412,No-job-no-money
0,1632231014.0,2021-09-2113:30:14,The hardest lessons that you have to learn in the dating scene,11606,psirff,11258,dating_advice,348,2021-09-2106:30:14,0,1345,Any-Discussion-5934
0,1606779216.0,2020-11-3023:33:36,No more Single Moms for me :(,11990,k489w6,11031,dating_advice,959,2020-11-3015:33:36,0,1098,fompty1988
0,1617707651.0,2021-04-0611:14:11,Ravens are capable of high-quality imitation of human speech,59748,ml98mn,56761,Awwducational,2987,2021-04-0604:14:11,0,1055,regian24
0,1617481758.0,2021-04-0320:29:18,American Kestrel is the smallest and most common falcon in North America. It is also called the Sparrow Hawk,51589,mjgll8,50042,Awwducational,1547,2021-04-0313:29:18,0,419,A_Lazko
0,1606565908.0,2020-11-2812:18:28,Wolverines can be taught to rescue avalanche survivors.,50562,k2mqw6,49046,Awwducational,1516,2020-11-2804:18:28,0,800,skyfall91404
0,1623263403.0,2021-06-0918:30:03,Manatees have no significant natural predators and can be found co-existing peacefully with gators.,42743,nw2sfc,41461,Awwducational,1282,2021-06-0911:30:03,0,703,themflyingeyes
0,1630585132.0,2021-09-0212:18:52,"Some species of birds turn to living mammals as a source of building material for their nests. The process of stealing hair is called kleptotrichy, and birds will test their ability to pluck hair from various mammals. In this vid, a black-crested titmouse is plucking hairs from a snoozing fox.",40994,pggqb5,39355,Awwducational,1639,2021-09-0205:18:52,0,636,KimCureAll
0,1635085703.0,2021-10-2414:28:23,He figured out a way to get up onto the big chair.,87745,qet8yf,83358,rarepuppers,4387,2021-10-2407:28:23,0,805,5_Frog_Margin
0,1618833506.0,2021-04-1911:58:26,Told him to stay in the camper. Door didn’t click. 45 mins later came back to this. Kai is a good boy,82418,mtz0g5,79122,rarepuppers,3296,2021-04-1904:58:26,0,678,rossionq1
0,1629751297.0,2021-08-2320:41:37,"My sister has COVID so is isolating, but she is my dog’s favourite. He’s waiting outside her room because he misses her.",78667,pa8do5,73161,rarepuppers,5506,2021-08-2313:41:37,0,909,Kemphy
0,1618772613.0,2021-04-1819:03:33,He float rather jump.,69398,mtj3ut,64541,rarepuppers,4857,2021-04-1812:03:33,0,513,akasaiga
0,1624129735.0,2021-06-1919:08:55,There are two types of dog,65479,o3nhjb,62860,rarepuppers,2619,2021-06-1912:08:55,0,508,lmaosmh
0,1608984363.0,2020-12-2612:06:03,YSK that people dealing with depression can find it incredibly hard to maintain contact with friends and family. If someone hasn’t been in touch for months don’t assume they’re a bad friend.,74531,kkhm94,67824,YouShouldKnow,6707,2020-12-2604:06:03,0,1317,shortercrust
0,1627990347.0,2021-08-0311:32:27,"YSK that letting your dog sniff on walks is very enriching, interesting, and stimulating for them. Your dog sniffing every little thing in the neighborhood is equivalent to us reading the newspaper; its how they absorb information, and will give you a calmer dog!",73808,ox1jjw,66428,YouShouldKnow,7380,2021-08-0304:32:27,0,2055,SalzyJ
0,1619649647.0,2021-04-2822:40:47,"YSK if you randomly see a dryer sheet in the back of your mailbox, your mail carrier put it there for a reason",64201,n0qs06,59707,YouShouldKnow,4494,2021-04-2815:40:47,0,1434,istrx13
0,1624481706.0,2021-06-2320:55:06,YSK: Every Car Built from 2018 Onwards is REQUIRED to Have a Backup Camera -- It is not an extra feature,62494,o6lscq,58120,YouShouldKnow,4374,2021-06-2313:55:06,0,2048,themikesem
0,1614781950.0,2021-03-0314:32:30,"YSK: The FCC just approved a $50 a month subsidy for low-income households to get high-speed internet, plus a $100 discount on a computer.",61276,lwv8ip,56374,YouShouldKnow,4902,2021-03-0306:32:30,0,3707,struggling_dude110
0,1608643811.0,2020-12-2213:30:11,Military recruit saved after dropping live grenade at his feet,82370,ki5crf,78252,nonononoyes,4118,2020-12-2205:30:11,0,2904,NewsflareBarney
0,1624441250.0,2021-06-2309:40:50,No way! .... What?!,63373,o69inx,55769,nonononoyes,7604,2021-06-2302:40:50,0,1145,MaxMustemal
0,1630621523.0,2021-09-0222:25:23,Dude didn’t miss a beat,55031,pgs5c5,52830,nonononoyes,2201,2021-09-0215:25:23,0,593,Ace-Ventura1934
0,1629835213.0,2021-08-2420:00:13,Man jumps through car window to try stopping it before it hits the houses,50042,pav05c,48541,nonononoyes,1501,2021-08-2413:00:13,0,767,SassyPerere
0,1631110544.0,2021-09-0814:15:44,This looks easy,50700,pkbdh8,47151,nonononoyes,3549,2021-09-0807:15:44,0,669,niginger
0,1630208742.0,2021-08-2903:45:42,"Hurricane Ida is coming straight for me tomorrow night, so I took home the stray cat that hangs outside the Rehab I work at so it’ll have shelter and protection from the Disaster. Meet Soup!",93606,pdo4dg,86118,cats,7488,2021-08-2820:45:42,0,1923,HydeLA
0,1613693325.0,2021-02-1900:08:45,She has a lucky sock. Very necessary when monitoring the bird situation.,78671,ln1fep,75525,cats,3146,2021-02-1816:08:45,0,1006,hurricanesally
0,1636295841.0,2021-11-0714:37:21,Found in the dumpster tied in a trash bag. What a sweet soul as well. Poor thing.,75854,qopso3,69028,cats,6826,2021-11-0706:37:21,0,1864,zack1567
0,1628891736.0,2021-08-1321:55:36,I got dumped so I went to the humane society and chose the first cat that sat in my lap and stayed there. I've never met a sweeter boy. Names?,77259,p3v44o,67216,cats,10043,2021-08-1314:55:36,0,4846,Rose_en_Quartz
0,1630833440.0,2021-09-0509:17:20,I’m new to cats my cat does this every morning is this normal?,73449,pi9vmq,66839,cats,6610,2021-09-0502:17:20,0,4272,sandals-beach
0,1617275527.0,2021-04-0111:12:07,MRW someone pointed out how bad my top post is,66823,mht0g2,60141,HighQualityGifs,6682,2021-04-0104:12:07,0,600,SecretFootToucher
0,1624533259.0,2021-06-2411:14:19,Cartoon Legends: Battle Royale,68105,o6yrww,59933,HighQualityGifs,8172,2021-06-2404:14:19,0,701,elpinko
0,1611852240.0,2021-01-2816:44:00,The $GME and r/wsb scenario explained by Margot Robbie in a bathtub,63479,l71u72,59036,HighQualityGifs,4443,2021-01-2808:44:00,0,679,somebadmeme
0,1607691218.0,2020-12-1112:53:38,We should have listened to Dwight in February,60611,kb281k,56975,HighQualityGifs,3636,2020-12-1104:53:38,0,886,dippitydoo2
0,1617624839.0,2021-04-0512:13:59,It's another beautiful morning on the subreddit!,62382,mkj95s,56768,HighQualityGifs,5614,2021-04-0505:13:59,0,460,Otomyre
0,1616008061.0,2021-03-1719:07:41,Japan's capital be like:,72317,m77z8k,71594,HistoryMemes,723,2021-03-1712:07:41,0,384,TheDreamingGhost
0,1619094808.0,2021-04-2212:33:28,"22 April, 2001, a legend entered our world",74184,mw3q1y,71217,HistoryMemes,2967,2021-04-2205:33:28,0,709,Mollusc_Memes
0,1607881790.0,2020-12-1317:49:50,So much spice!,66393,kcf03u,65066,HistoryMemes,1327,2020-12-1309:49:50,0,587,Mr_Elijiah
0,1619609400.0,2021-04-2811:30:00,"You're a S̶o̶v̶i̶e̶t̶ Russian, Harry",63016,n0cq0o,62386,HistoryMemes,630,2021-04-2804:30:00,0,483,Corleone_Michael
0,1606073578.0,2020-11-2219:32:58,So true,63232,jz1srv,60071,HistoryMemes,3161,2020-11-2211:32:58,0,574,deadlyspawn187
0,1609801747.0,2021-01-0423:09:07,UPDATE: I (30F) caught my husband (31M) in an affair and I don’t know how to move forward.,16190,kqkj9c,16029,relationships,161,2021-01-0415:09:07,0,381,Ohwhoaeskimo
0,1611605295.0,2021-01-2520:08:15,Update to the pettiest question ever,14931,l4wa08,14633,relationships,298,2021-01-2512:08:15,0,246,lkasjfsaldkfj
0,1614876363.0,2021-03-0416:46:03,"UPDATE: Me [36 M] married to my Wife [36 F] 11 years, and I can't stop thinking about a girl I dated for 1 month 16 years ago.",11663,lxp1ee,11430,relationships,233,2021-03-0408:46:03,0,206,Thor442
0,1621599463.0,2021-05-2112:17:43,UPDATE : I (46F) have hurt my daughter (16F) by giving her friend(16F) a few books,8192,nhr3yo,8029,relationships,163,2021-05-2105:17:43,0,129,Far-Challenge-4300
0,1611683569.0,2021-01-2617:52:49,UPDATE: My (29M) soon to be ex-husband seems to feel entitled to another chance with me (28F).,7478,l5jc7c,7329,relationships,149,2021-01-2609:52:49,0,160,throwaway246813572
0,1609772995.0,2021-01-0415:09:55,"Just found out about a month ago someone posted my art here claiming they made it on LSD. They didn't. Here it is again with proper attribution - ""City Train Adventure"".",27239,kqaj3g,26422,drawing,817,2021-01-0407:09:55,0,397,evanart
0,1631450381.0,2021-09-1212:39:41,Please help me to pick three of these,27866,pmryku,25916,drawing,1950,2021-09-1205:39:41,0,5519,gamingroof
0,1618925938.0,2021-04-2013:38:58,My self portrait in 2012 vs 2021.,23689,muqirr,22979,drawing,710,2021-04-2006:38:58,0,611,arinzestanley
0,1628919701.0,2021-08-1405:41:41,So happy with the results. 3 nights in a row. About 30hrs of study + drawing. 3 failed attempts,21670,p42bqg,21020,drawing,650,2021-08-1322:41:41,0,564,sykonet
0,1619218634.0,2021-04-2322:57:14,🐥👨‍🍳,17604,mx79s4,17252,drawing,352,2021-04-2315:57:14,0,160,olio_Drw
0,1614593000.0,2021-03-0110:03:20,"Contrary to popular belief about guys, the single men I know keep their homes exceptionally clean. What male stereotypes don’t apply to you?",42821,lv5fjo,38111,AskMen,4710,2021-03-0102:03:20,0,9447,Toadie9622
0,1613131112.0,2021-02-1211:58:32,"As an introvert, how do you feel about this quote by Jim Carrey? “Solitude is dangerous. It’s very addictive. It becomes a habit after you realize how calm and peaceful it is. It’s like you don’t want to deal with people anymore because they drain your energy.”",40206,li9mlf,36990,AskMen,3216,2021-02-1203:58:32,0,1773,SeaworthinessMuch425
0,1609601966.0,2021-01-0215:39:26,"Men of Reddit, how often have do/do you change your walk because you’re walking behind a woman late at night?",37247,kozhbc,32033,AskMen,5214,2021-01-0207:39:26,0,6926,InspiredBlue
0,1627828694.0,2021-08-0114:38:14,How can you work a 9 to 5 Job with only the Weekends and 4 weeks per year Off without getting the feeling of waisting your life?,35337,ovt9k9,30744,AskMen,4593,2021-08-0107:38:14,0,7978,69motherducker420
0,1610779540.0,2021-01-1606:45:40,How early in the relationship can I bust out the Lord of the Rings extended edition?,32040,kydy91,29798,AskMen,2242,2021-01-1522:45:40,0,1558,Gamer_ely
0,1628185820.0,2021-08-0517:50:20,[FC Barcelona] Messi will not renew with FC Barcelona,59689,oynqqa,58496,soccer,1193,2021-08-0510:50:20,0,8962,SuperBros697
0,1626040459.0,2021-07-1121:54:19,[Italy] have won the UEFA EURO 2020,52994,oidg3u,47165,soccer,5829,2021-07-1114:54:19,0,10714,BVB-Oeli
0,1606320767.0,2020-11-2516:12:47,Maradona passed away at the age of 60,45051,k0uzsv,44150,soccer,901,2020-11-2508:12:47,0,4644,Fvoltes
0,1630079525.0,2021-08-2715:52:05,United confirm Ronaldo agreement,45621,pcq1c9,43340,soccer,2281,2021-08-2708:52:05,0,4409,AlphaStryk3r
0,1618766197.0,2021-04-1817:16:37,Gary Neville's full reaction to the news of a potential super league,42379,mth0jz,41532,soccer,847,2021-04-1810:16:37,0,2916,MUFColin
0,1608253451.0,2020-12-1801:04:11,"Cyberpunk 2077 has been removed from the Playstation store, all customers will be offered a full refund.",35447,kfapny,34030,Games,1417,2020-12-1717:04:11,0,7493,Autistic-Bicycle
0,1614277893.0,2021-02-2518:31:33,"Jason Schreier: ""Following the success of Jedi Fallen Order and the failure of Anthem, EA has allowed BioWare to make the next Dragon Age a single-player RPG. Previously, it was planned as a service game""",21377,lsdc08,20950,Games,427,2021-02-2510:31:33,0,2314,beary_good
0,1607721114.0,2020-12-1121:11:54,Games Made Under Crunch Conditions Don’t Deserve ‘Best Direction’ Awards- Kotaku,22279,kbbg4o,18492,Games,3787,2020-12-1113:11:54,0,2582,GoneRampant1
0,1610544126.0,2021-01-1313:22:06,Open World Star Wars Game in Development at Ubisoft,18695,kwgbga,17761,Games,934,2021-01-1305:22:06,0,2441,tr0nc3k
0,1608309867.0,2020-12-1816:44:27,Cyberpunk Game Maker Faces Hostile Staff After Failed Launch,17545,kfombe,16844,Games,701,2020-12-1808:44:27,0,3317,Aratho
0,1630192977.0,2021-08-2823:22:57,Here's a Beaver carrying a carrot and a head of lettuce back to his home.,139310,pdk7ps,135131,Eyebleach,4179,2021-08-2816:22:57,0,2071,5_Frog_Margin
0,1628822548.0,2021-08-1302:42:28,Kitten learns how to groom itself by watching a tutorial,117610,p3ep0j,111730,Eyebleach,5880,2021-08-1219:42:28,0,788,Ques3
0,1625778844.0,2021-07-0821:14:04,This woman adopted this 20-year-old cat from a shelter because she didn't want him to spend the end of his life alone in a cage.,116309,oggmyx,108168,Eyebleach,8141,2021-07-0814:14:04,0,1788,Mohan_Yadav
0,1633468623.0,2021-10-0521:17:03,After the overwhelming support I got I realized older cats get adopted less than I thought. Here is 12 year old Hermes who has lived in the shelter for six years. The lady started crying in joy when I said I wanted him.,107903,q25ttb,101429,Eyebleach,6474,2021-10-0514:17:03,0,1651,Bloodyfaucet
0,1632397865.0,2021-09-2311:51:05,Dog says goodbye to everyone who leaves the store,96538,ptthpz,93642,Eyebleach,2896,2021-09-2304:51:05,0,756,notGhxst
0,1614025147.0,2021-02-2220:19:07,Cursed_idea,136604,lpypc4,129774,cursedcomments,6830,2021-02-2212:19:07,0,2465,oblivionnnnnnnnnnn
0,1621240176.0,2021-05-1708:29:36,Cursed_suicide,132995,nean1w,123686,cursedcomments,9309,2021-05-1701:29:36,0,4514,
0,1613105424.0,2021-02-1204:50:24,Cursed_SpareParts,126394,li3yg6,122603,cursedcomments,3791,2021-02-1120:50:24,0,1460,HeisterWolf
0,1632684563.0,2021-09-2619:29:23,Cursed_Disney,133052,pw0kms,118417,cursedcomments,14635,2021-09-2612:29:23,0,3140,richard-777
0,1609701415.0,2021-01-0319:16:55,Cursed light theme,124030,kpqu9i,116589,cursedcomments,7441,2021-01-0311:16:55,0,712,ReformedSink
0,1614882729.0,2021-03-0418:32:09,I know nobody cares BUT I ACTUALLY ATE AT A DEFICIT TODAY!!!!!! AND I DID MY FIRST FAST EVER!!!!! AND I DID 4000 STEPS!!!! I’m extremely proud of myself,16977,lxrn61,15619,loseit,1358,2021-03-0410:32:09,0,388,throwawaytreee1
0,1636114989.0,2021-11-0512:23:09,"An insanely long walk with my ""naturally thin"" friend",11435,qn9y37,11092,loseit,343,2021-11-0505:23:09,0,395,TheWeightfulDead
