image_id,unixtime,rawtime,title,total_votes,reddit_id,number_of_upvotes,subreddit,number_of_downvotes,localtime,score,number_of_comments,username
0,1616625467.0,2021-03-2422:37:47,An update on the recent issues surrounding a Reddit employee,170419,mcisdf,107364,announcements,63055,2021-03-2415:37:47,0,36725,spez
0,1630521123.0,2021-09-0118:32:03,COVID denialism and policy clarifications,21511,pg006s,13122,announcements,8389,2021-09-0111:32:03,0,1,worstnerd
0,1617297252.0,2021-04-0117:14:12,Second,0,mi01fg,0,announcements,0,2021-04-0110:14:12,0,1,powerlanguage
0,1623262631.0,2021-06-0918:17:11,Sunsetting Secret Santa and Reddit Gifts,0,nw2hs6,0,announcements,0,2021-06-0911:17:11,0,3501,KeyserSosa
0,1629933302.0,2021-08-2523:15:02,"Debate, dissent, and protest on Reddit",0,pbmy5y,0,announcements,0,2021-08-2516:15:02,0,1,spez
0,1633368319.0,2021-10-0417:25:19,Zuckerberg right now,228357,q1a7iu,205522,funny,22835,2021-10-0410:25:19,0,3945,Ericgreg20
0,1616261582.0,2021-03-2017:33:02,"""Where's your mask?"" prank",225631,m9btq6,194043,funny,31588,2021-03-2010:33:02,0,6871,BalodyaMan
0,1631280442.0,2021-09-1013:27:22,Going back to the office,204338,pll14q,187991,funny,16347,2021-09-1006:27:22,0,3018,DefaultAnthony
0,1627259025.0,2021-07-2600:23:45,Gym,189606,ornjub,170646,funny,18960,2021-07-2517:23:45,0,1125,ndetro
0,1608477332.0,2020-12-2015:15:32,Our baby announcement photo. My wife looked so obnoxiously thin 24 hours after delivery that I joked I looked like the one who had just delivered. So we decided to swap for a funny photo.,189565,kgvne6,168713,funny,20852,2020-12-2007:15:32,0,1971,tyleryoungblood
0,1611859882.0,2021-01-2818:51:22,"How would you feel about Reddit adding 3 NSFW filters to distinguish between porn, gore, and repetitive posts asking how you would feel about Reddit adding 2 NSFW filters to distinguish between porn and gore?",250491,l7530r,217928,AskReddit,32563,2021-01-2810:51:22,0,2939,SoupIsAHotSmoothie
0,1609883274.0,2021-01-0521:47:54,"How would you feel about a ""if you accidentally scroll to the top, you can go back to where you were,"" button for Reddit?",231618,kr8op6,182979,AskReddit,48639,2021-01-0513:47:54,0,4365,Cheap_Double9726
0,1608946885.0,2020-12-2601:41:25,"What if Earth is like one of those uncontacted tribes in South America, like the whole Galaxy knows we're here but they've agreed not to contact us until we figure it out for ourselves?",170916,kka536,152116,AskReddit,18800,2020-12-2517:41:25,0,8676,slim_p_
0,1610188491.0,2021-01-0910:34:51,"People of Reddit, how would you feel if there was a ""USA"" filter where non-Americans can scroll through Reddit freely without watching, hearing or reading what's going on in America?",207376,ktomhz,149311,AskReddit,58065,2021-01-0902:34:51,0,11088,TorsoHunter
0,1633365005.0,2021-10-0416:30:05,How is everyone enjoying Reddit while Instagram Facebook and whatsapp are all down?,186146,q18zrj,147056,AskReddit,39090,2021-10-0409:30:05,0,14050,PastaM0nster
0,1608923250.0,2020-12-2519:07:30,My parents (late 70s) got me a ps5 controller for Christmas. I do not own a playstation 5...,256588,kk478s,241193,gaming,15395,2020-12-2511:07:30,0,5550,Yabba_Dabbs
0,1614613269.0,2021-03-0115:41:09,boy gamer,242279,lvcakc,220474,gaming,21805,2021-03-0107:41:09,0,6644,velabas
0,1610550600.0,2021-01-1315:10:00,EA will no longer have exclusive rights of the Star Wars games,182331,kwi9yr,173215,gaming,9116,2021-01-1307:10:00,0,8562,PrikroyMan
0,1612205407.0,2021-02-0118:50:07,Happy Black History Month,198660,laar3i,172835,gaming,25825,2021-02-0110:50:07,0,2233,DylanP3692
0,1623701280.0,2021-06-1420:08:00,"Don't gamble it, be patient",205207,nzvpb2,170322,gaming,34885,2021-06-1413:08:00,0,6990,SrGrafo
0,1618353872.0,2021-04-1322:44:32,"My deaf puppy doesn’t notice whenever I come home, so I get to wake her up gently and see her innocent excitement.",206934,mqdgix,200726,aww,6208,2021-04-1315:44:32,0,2572,devinmburgess
0,1627938671.0,2021-08-0221:11:11,They are so proud of it..,187312,ownzkg,179820,aww,7492,2021-08-0214:11:11,0,1462,Pedrica1
0,1611829222.0,2021-01-2810:20:22,4yo in Virginia today went outside to play then came back to the front door with a new friend,171500,l6tf78,161210,aww,10290,2021-01-2802:20:22,0,2188,SeenSomeThangs
0,1607267932.0,2020-12-0615:18:52,"Two years and TONS of walks later, Shiloh has reached her target weight!!",167178,k7vhum,160491,aww,6687,2020-12-0607:18:52,0,1459,mikerich15
0,1620242813.0,2021-05-0519:26:53,rescued baby seal's first swim lesson,153577,n5oacm,148970,aww,4607,2021-05-0512:26:53,0,2233,m33gs
0,1637145747.0,2021-11-1710:42:27,Travis Scott Facing $750 Million Astroworld Lawsuit from 125+ Attendees,98303,qvwl1i,89456,Music,8847,2021-11-1702:42:27,0,6726,Existing_Cow_3907
0,1614005051.0,2021-02-2214:44:11,Daft Punk Call It Quits,87374,lppn5i,79511,Music,7863,2021-02-2206:44:11,0,4704,shabuluba
0,1617984884.0,2021-04-0916:14:44,DMX Has Died at 50,89985,mnkp67,75588,Music,14397,2021-04-0909:14:44,0,4899,shabuluba
0,1606535406.0,2020-11-2803:50:06,"System of a Down's ""Chop Suey"" becomes first metal music video with 1 billion YouTube views",83171,k2gja8,73191,Music,9980,2020-11-2719:50:06,0,2628,DallasSF
0,1636325208.0,2021-11-0722:46:48,For anyone defending the trash that is Travis Scott..,82904,qozw4r,67982,Music,14922,2021-11-0714:46:48,0,6811,hmarin513
0,1611864881.0,2021-01-2820:14:41,"Twelve years ago, the world was bankrupted and Wall Street celebrated with champagne.",263037,l77fdv,249886,pics,13151,2021-01-2812:14:41,0,6742,a-horse-has-no-name
0,1610200681.0,2021-01-0913:58:01,How it started and how it’s going,254136,ktrcoo,223640,pics,30496,2021-01-0905:58:01,0,10800,DaFunkJunkie
0,1607808225.0,2020-12-1221:23:45,I overcame my depression and went for a hike :) It's the small things.,247792,kbxb0n,218057,pics,29735,2020-12-1213:23:45,0,4656,JesseD320
0,1611184224.0,2021-01-2023:10:24,His first photo in the Oval Office,276467,l1l3er,212880,pics,63587,2021-01-2015:10:24,0,7012,jcepiano
0,1608664778.0,2020-12-2219:19:38,"After I posted my painting of Bad Luck Brian, Mr. Bad Luck himself contacted me to purchase it.",216158,kic0ea,205351,pics,10807,2020-12-2211:19:38,0,2177,mnhaverland
0,1606846532.0,2020-12-0118:15:32,An anti-gay Hungarian politician has resigned after being caught by police fleeing a 25-man orgy through a window,219934,k4qide,204539,worldnews,15395,2020-12-0110:15:32,0,8487,stem12345679
0,1610984476.0,2021-01-1815:41:16,B-52 US bombers fly over Middle East; Iran condemns intimidation. Iranian foreign minister says the US would be better off spending its military billions ‘on your taxpayers’ health’.,182780,kzx08x,148052,worldnews,34728,2021-01-1807:41:16,0,8216,singleboomer
0,1619108190.0,2021-04-2216:16:30,UK Parliament unanimously declares the Chinese government is committing a Genocide against Uyghurs in historic first,158616,mw8d2j,141169,worldnews,17447,2021-04-2209:16:30,0,6159,Oddsock1701
0,1611938939.0,2021-01-2916:48:59,'Price gouging from Covid': student ebooks costing up to 500% more than in print - Call for inquiry into academic publishers as locked-down students unable to access study material online,143737,l7xe41,135113,worldnews,8624,2021-01-2908:48:59,0,3514,Sumit316
0,1617299024.0,2021-04-0117:43:44,New Zealand raises minimum wage to $20 an hour and raises taxes on the rich.,176734,mi0pat,132551,worldnews,44183,2021-04-0110:43:44,0,7683,ChargingAntelope
0,1607978957.0,2020-12-1420:49:17,"LED lights found to kill coronavirus efficiently, quickly, and cheaply, a global first in fight against COVID-19. The finding suggests the UV-LEDs can be installed in air conditioning and water systems. It requires less than half a minute to destroy more than 99.9% of coronaviruses.",127141,kd67rx,114427,science,12714,2020-12-1412:49:17,0,3575,mvea
0,1612211502.0,2021-02-0120:31:42,"Wealthy, successful people from privileged backgrounds often misrepresent their origins as working-class in order to tell a ‘rags to riches’ story resulting from hard work and perseverance, rather than social position and intergenerational wealth.",145807,lad9pe,113730,science,32077,2021-02-0112:31:42,0,3187,sciposts
0,1614780956.0,2021-03-0314:15:56,"Casual sex among young adults has declined due to decline in drinking, an increase in computer gaming, and more young adults living with their parents.",124343,lwuvpc,110666,science,13677,2021-03-0306:15:56,0,9643,smurfyjenkins
0,1606428305.0,2020-11-2622:05:05,"In the US, states typically pay for prison while counties determine sentencing. A natural experiment whereby the cost burden of juvenile incarceration was placed on counties led to a stark drop in incarceration. This suggests that mass incarceration in the US is in part due to misaligned incentives.",116600,k1ofcu,106106,science,10494,2020-11-2614:05:05,0,1830,smurfyjenkins
0,1611228462.0,2021-01-2111:27:42,"Korean scientists developed a technique for diagnosing prostate cancer from urine within only 20 minutes with almost 100% accuracy, using AI and a biosensor, without the need for an invasive biopsy. It may be further utilized in the precise diagnoses of other cancers using a urine test.",112674,l1work,104787,science,7887,2021-01-2103:27:42,0,1156,mvea
0,1611879650.0,2021-01-2900:20:50,"TIL that slaveholders in the US knew that enslaved people were escaping to Mexico, the U.S. tried to get Mexico to sign a fugitive slave treaty, but Mexico refused to sign such a treaty, insisting that all enslaved people were free once they set foot on Mexican soil.",181453,l7does,166937,todayilearned,14516,2021-01-2816:20:50,0,3955,_The_Architect
0,1612928848.0,2021-02-1003:47:28,"TIL Genghis Khan would marry off a daughter to the king of an allied nation. Then he would assign his new son in law to military duty in the Mongol wars, while his daughter took over the rule. Most sons in law died in combat, giving his daughters complete control of these nations",166700,lgl7ag,156698,todayilearned,10002,2021-02-0919:47:28,0,3283,_pancake_lover_
0,1615999192.0,2021-03-1716:39:52,"TIL: Microsoft tried a 4-day workweek in Japan as part of a ""Work Life Choice Challenge"" by shutting down offices every Friday. Productivity, measured by sales per employee, increased by almost 40% compared to the same period the previous year.",146409,m74jtd,136161,todayilearned,10248,2021-03-1709:39:52,0,3709,SeizeOpportunity
0,1612381580.0,2021-02-0319:46:20,"TIL that William Whipple, one of the 56 signers of the Declaration of Independence, freed his slave after signing it because he believed one cannot simultaneously fight for freedom and hold another person in bondage.",143231,lbwbqs,134638,todayilearned,8593,2021-02-0311:46:20,0,2407,NikMarus
0,1622733795.0,2021-06-0315:23:15,"TIL before any details of Pixar’s ‘Soul’ were public, a Black chauffeur told Kemp Powers (the film’s co-writer & co-director) that he knew Pixar was making a Black movie because he had never driven so many Black people to Pixar before.",145617,nrg2fs,129600,todayilearned,16017,2021-06-0308:23:15,0,4033,CocaTrooper42
0,1635271423.0,2021-10-2618:03:43,‘Dune’ Sequel Greenlit By Legendary For Exclusive Theatrical Release,119422,qgca14,107480,movies,11942,2021-10-2611:03:43,0,6629,CosmicBlazeKnight
0,1607647232.0,2020-12-1100:40:32,First image of Pixar's 'Lightyear' Starring Chris Evans - the definitive story of the original Buzz Lightyear,119028,karqzi,101174,movies,17854,2020-12-1016:40:32,0,3333,SanderSo47
0,1615320388.0,2021-03-0920:06:28,"First image of Adam Driver and Lady Gaga as Maurizio Gucci and Patrizia Reggiani in Ridley Scott’s ‘House of Gucci’ - The story of how Patrizia Reggiani, the ex-wife of Maurizio Gucci, plotted to kill her husband, the grandson of renown fashion designer Guccio Gucci.",108475,m1ezgs,92204,movies,16271,2021-03-0912:06:28,0,2601,impeccabletim
0,1622395367.0,2021-05-3017:22:47,I hate inconsistent movie volume,101506,nofv1b,89326,movies,12180,2021-05-3010:22:47,0,6607,DubstepDonut
0,1606630200.0,2020-11-2906:10:00,Dave Prowse: Darth Vader actor dies aged 85,96730,k34e08,88992,movies,7738,2020-11-2822:10:00,0,2002,Beanzthebear
0,1609717326.0,2021-01-0323:42:06,"Jared, the man behind the famous South Park WoW cosplay has passed away due to Covid-19. RIP",169939,kpw1i4,146148,videos,23791,2021-01-0315:42:06,0,4485,sleepysnowboarder
0,1607480223.0,2020-12-0902:17:03,"Roughly the first five seconds of ""Never Gonna Give You Up"" is now a silent Sony Music title card that displays copyright and licensing information, essentially ruining Rick Rolling",175385,k9iqgk,135047,videos,40338,2020-12-0818:17:03,0,4838,PKghost
0,1612014918.0,2021-01-3013:55:18,Jim Cramer admitting to how he manipulated the short selling market back in 2006. This needs to be seen by all!,97070,l8m69d,87363,videos,9707,2021-01-3005:55:18,0,2643,RedRangerJ
0,1610467614.0,2021-01-1216:06:54,GTA V: Lamar Roasts Franklin in Real-Life (with Slink Johnson & Shawn Fonteno) - The actors for Lamar and Franklin reenact the meme in real life,86264,kvuhqn,75913,videos,10351,2021-01-1208:06:54,0,1403,kubj31196
0,1611834863.0,2021-01-2811:54:23,Payne sounds off on Wall St over GameStop: All of this whining is making me sick,78246,l6uur7,71987,videos,6259,2021-01-2803:54:23,0,2902,Subdued_Volatility
0,1618952864.0,2021-04-2021:07:44,"Chauvin found guilty of murder, manslaughter in George Floyd's death",312841,mv0fzt,250273,news,62568,2021-04-2014:07:44,0,28056,Too_Hood_95
0,1611148604.0,2021-01-2013:16:44,Trump has left the White House for the last time as President,271496,l18yys,222627,news,48869,2021-01-2005:16:44,0,11801,gumball_Jones
0,1611161640.0,2021-01-2016:54:00,"Joe Biden officially sworn in as the 46th President of the United States, Kamala Harris as the 49th Vice-President",239027,l1d2ko,176880,news,62147,2021-01-2008:54:00,0,9090,douglasmacarthur
0,1610573130.0,2021-01-1321:25:30,Donald Trump impeached for ‘inciting’ US Capitol riot,222330,kwqbtc,175641,news,46689,2021-01-1313:25:30,0,13136,amtrusc
0,1610148532.0,2021-01-0823:28:52,Twitter permanently suspends Trump’s account,213857,ktenem,171086,news,42771,2021-01-0815:28:52,0,13792,Urf_Hates_You
0,1615314620.0,2021-03-0918:30:20,Humans cannot even live in harmony with their own species and somehow still convince themselves that meeting an extra-terrestrial species would go smoothly,126687,m1cutd,112752,Showerthoughts,13935,2021-03-0910:30:20,0,3187,
0,1613641688.0,2021-02-1809:48:08,"People who jog on the roads in the dark, wearing dark clothing and no lights or reflectors are a unique combination of a person who cares about their health and well-being and doesn’t care about their health and well-being.",117164,lmj453,106620,Showerthoughts,10544,2021-02-1801:48:08,0,2295,MrSeverum
0,1614982568.0,2021-03-0522:16:08,You know you’re an adult when you miss trash day and it ruins your entire week.,114589,lynbbe,104276,Showerthoughts,10313,2021-03-0514:16:08,0,2590,frickafreshhh
0,1614943265.0,2021-03-0511:21:05,The ten years between 25 and 35 are far shorter than the four years between 14 and 18.,114172,ly9rez,97047,Showerthoughts,17125,2021-03-0503:21:05,0,3739,BandaidPuppet
0,1611203673.0,2021-01-2104:34:33,"Drinking cow’s milk is okay, but drinking a woman’s breast milk is weird. Sucking a woman’s breast is okay, but sucking a cow’s udder is weird.",105663,l1r2o5,90871,Showerthoughts,14792,2021-01-2020:34:33,0,3234,AnthropomorphicMango
0,1609972710.0,2021-01-0622:38:30,Why did it take the police so long to show up to Capitol Hill today?,84290,krz283,70804,Jokes,13486,2021-01-0614:38:30,0,1437,icelandic_hotdog
0,1620050924.0,2021-05-0314:08:44,"Can we ban ""yo momma"" jokes from this sub? They're old, stupid and have been done by literally everyone hundreds of times",77097,n3x0hc,59365,Jokes,17732,2021-05-0307:08:44,0,3344,merio67
0,1610092564.0,2021-01-0807:56:04,What's the difference between the US Capitol and Mordor?,64706,ksy0qs,56942,Jokes,7764,2021-01-0723:56:04,0,767,mertcanhekim
0,1607999022.0,2020-12-1502:23:42,"My wife says if this post get a 1000 likes, I can get anal on my cake day",68904,kdcnt4,50989,Jokes,17915,2020-12-1418:23:42,0,832,yzf426fm
0,1622757115.0,2021-06-0321:51:55,"Professor X asks a girl, ""what is your mutant power?""",55268,nrp0xt,49189,Jokes,6079,2021-06-0314:51:55,0,1459,Blorb-Man
0,1613947775.0,2021-02-2122:49:35,[Pro/Chef] Mirror Glazed Mousse Cake,73827,lp8rjv,69398,food,4429,2021-02-2114:49:35,0,1249,ragsy1224
0,1612741717.0,2021-02-0723:48:37,[PRO/CHEF] Texas Barbecue Platter,67310,leyy3r,58560,food,8750,2021-02-0715:48:37,0,1923,daynestxbbq
0,1616418181.0,2021-03-2213:03:01,[Homemade] Crunchwrap Supreme,64053,man1kl,58289,food,5764,2021-03-2206:03:01,0,1188,cookinwithclint
0,1608154086.0,2020-12-1621:28:06,[i ate] a classic NYC slice,62209,keievg,53500,food,8709,2020-12-1613:28:06,0,2105,viciousdv
0,1611334567.0,2021-01-2216:56:07,[Homemade] Chicken Tikka Masala with homemade Garlic Naan,57721,l2rs1l,53104,food,4617,2021-01-2208:56:07,0,1255,oobree
0,1633359627.0,2021-10-0415:00:27,It took me 3 years to get a permit to visit this surreal rock formation called the Wave in Arizona - it was worth it! [2000x2500][OC],84760,q174nw,79675,EarthPorn,5085,2021-10-0408:00:27,0,1513,mrcnzajac
0,1614524470.0,2021-02-2815:01:10,It took an entire day searching for a single formation but I finally found the Alien Throne in New Mexico’s badlands. [OC] [4016X6016] IG @danielbenjaminphoto,71539,luhzvc,66532,EarthPorn,5007,2021-02-2807:01:10,0,864,danielbenjaminphoto
0,1623070803.0,2021-06-0713:00:03,"It's a little unnerving when you wake up in the morning and find these right outside your tent... - Gates of the Arctic National Park, Alaska [OC][1335x2000] @mattymeis",70010,nubxr0,62309,EarthPorn,7701,2021-06-0706:00:03,0,1281,mattymeis
0,1606275612.0,2020-11-2503:40:12,"I hiked 22 grueling steps from the parking lot to take this photo. Yosemite National Park, CA. [2160×1440] (OC)",53844,k0kend,50614,EarthPorn,3230,2020-11-2419:40:12,0,466,vaporeon46
0,1615998283.0,2021-03-1716:24:43,"A composite of two of my photos that I created. Horsetail Falls, Yosemite National Park. {OC} [4480 x 5600]",55672,m747lc,48992,EarthPorn,6680,2021-03-1709:24:43,0,430,highventurer
0,1617239490.0,2021-04-0101:11:30,Many of us haven’t been sick in over a year due to lack of exposure to germs (COVID stay at home etc). Does this create any risk for our immune systems in the coming years?,26319,mhkbe3,24477,askscience,1842,2021-03-3118:11:30,0,678,idiomech
0,1611673954.0,2021-01-2615:12:34,"Israel has now given approximately 42% of its population one or more doses of Covid-19 vaccine. Has the vaccination program had a noticeable impact on covid-19 cases, hospitalizations and deaths so far in Israel?",19180,l5fxba,17454,askscience,1726,2021-01-2607:12:34,0,455,
0,1607952239.0,2020-12-1413:23:59,"Why can we develop a vaccine for COVID in 8 months, but still don't have a vaccine for other viruses that are decades old?",18538,kcxjhh,16499,askscience,2039,2020-12-1405:23:59,0,1470,Coppatop
0,1623655039.0,2021-06-1407:17:19,"The earth is about 4,5 billion years old, and the universe about 14,5 billion, if life isn't special, then shouldn't we have already been contacted?",20208,nzh4j0,15965,askscience,4243,2021-06-1400:17:19,0,1206,biker_philosopher
0,1616252102.0,2021-03-2014:55:02,Does the sun have a solid(like) surface?,15157,m98m4q,14400,askscience,757,2021-03-2007:55:02,0,857,Solestian
0,1623523845.0,2021-06-1218:50:45,I’m a lobster diver who recently survived being inside of a whale. AMA!,102079,nydiqd,90851,IAmA,11228,2021-06-1211:50:45,0,8716,bloxiefox
0,1616176973.0,2021-03-1918:02:53,"I’m Bill Gates, co-chair of the Bill and Melinda Gates Foundation and author of “How to Avoid a Climate Disaster.” Ask Me Anything.",100978,m8n4vt,66646,IAmA,34332,2021-03-1911:02:53,0,14288,thisisbillgates
0,1636570636.0,2021-11-1018:57:16,"Hi, I’m Todd Howard, Game Director and Executive Producer at Bethesda Game Studios. Here to celebrate Skyrim’s 10th anniversary, but of course, Ask Me Anything. Thanks!",51798,qr1f5c,37813,IAmA,13985,2021-11-1010:57:16,0,7112,ToddBethesda
0,1617029760.0,2021-03-2914:56:00,"Hi!! I'm Vic, a former Amazon driver who was interviewed about the cameras in our vans and the reasons I quit. You may have seen this article on r/Technology and Business Insider. I want to stand behind my former coworkers and fight for their rights as workers. Ask me anything!!",41454,mfrbty,36480,IAmA,4974,2021-03-2907:56:00,0,3992,Vic_From_Amazon
0,1635871027.0,2021-11-0216:37:07,"Hi! I'm Philipp Dettmer, founder and head writer of Kurzgesagt, one of the largest science channels on YouTube with over sixteen million subscribers - AMA",39942,ql88mw,36348,IAmA,3594,2021-11-0209:37:07,0,1873,kurz_gesagt
0,1628878169.0,2021-08-1318:09:29,I've been paralyzed along my right side for the last 9 years. Look at what I've been able to do for the first time in those 9 years. 👍,167133,p3qq33,140392,gifs,26741,2021-08-1311:09:29,0,3091,Two-Tone-
0,1611180063.0,2021-01-2022:01:03,Melania Trump doesn’t care anymore,170866,l1joqd,136693,gifs,34173,2021-01-2014:01:03,0,6297,mati98
0,1634212821.0,2021-10-1412:00:21,1 year epoxy hot dog update,151820,q7y8hh,116902,gifs,34918,2021-10-1405:00:21,0,2994,whathowyy
0,1611160526.0,2021-01-2016:35:26,Joe Biden fist-bumps Barack Obama,169845,l1cort,115495,gifs,54350,2021-01-2008:35:26,0,2610,sintaroactual
0,1630781212.0,2021-09-0418:46:52,Elizabeth Olsen keeping Aubrey Plaza warm,137302,phx8gq,113961,gifs,23341,2021-09-0411:46:52,0,2256,unknown_human
0,1611871714.0,2021-01-2822:08:34,People Are Accusing Robinhood Of Stealing From The Poor To Give To The Rich After It Limited Trading On Gamestop Shares,190221,l7afyx,178808,nottheonion,11413,2021-01-2814:08:34,0,4417,hilbertthedog
0,1635191950.0,2021-10-2519:59:10,Hiker lost on mountain for 24 hours ignored calls from rescuers because he didn’t recognize phone number,126990,qfozej,118101,nottheonion,8889,2021-10-2512:59:10,0,3400,thebigdonkey
0,1613182336.0,2021-02-1302:12:16,DoorDash Spent $5.5 Million To Advertise Their $1 Million Charity Donation,118713,liqvh2,110404,nottheonion,8309,2021-02-1218:12:16,0,3087,bubblydeadpan
0,1610412565.0,2021-01-1200:49:25,"Jake Angeli, horned man who stormed Capitol, refuses to eat as guards won't feed him 'organic food'",122215,kvgi85,108772,nottheonion,13443,2021-01-1116:49:25,0,7136,3dprinteddildo
0,1610067842.0,2021-01-0801:04:02,Man died at U.S. Capitol after accidentally tasering himself and having a heart attack,113110,ksrilh,104062,nottheonion,9048,2021-01-0717:04:02,0,5001,irish91
0,1610060683.0,2021-01-0723:04:43,Simon & Schuster Cancels Plans for Senator Hawley’s Book,66898,ksp9g5,57533,books,9365,2021-01-0715:04:43,0,80,The_Iceman2288
0,1606667952.0,2020-11-2916:39:12,"Your Local Bookstore Wants You to Know It’s Struggling: “Buy books from people who want to sell books, not colonize the moon.""",58200,k3cen6,49470,books,8730,2020-11-2908:39:12,0,2687,atomicspace
0,1609788686.0,2021-01-0419:31:26,"'The Great Gatsby' Enters The Public Domain, And The People Want A Muppets Version",57590,kqfwi0,48952,books,8638,2021-01-0411:31:26,0,1174,dcdiehardfan
0,1610988117.0,2021-01-1816:41:57,Hundreds of writers and book agents sign joint letter demanding publishing industry bans Trump memoir,72148,kzy8ks,46175,books,25973,2021-01-1808:41:57,0,101,Obliterature
0,1608509988.0,2020-12-2100:19:48,Star Wars Novelists Seek Years of Missing Royalty Payments From Disney,46854,kh5upt,44043,books,2811,2020-12-2016:19:48,0,1429,scott_steiner_phd
0,1614032006.0,2021-02-2222:13:26,"LPT: Texans, you are about to experience the worst potholes many of you have ever seen. Make sure your tire pressure is correct for your vehicles, drive slowly, give plenty of distance between your vehicle and the one in front of you, and don't trust puddles. Love from Michigan.",152638,lq1jn7,135848,LifeProTips,16790,2021-02-2214:13:26,0,4127,this1tyme
0,1610935758.0,2021-01-1802:09:18,LPT: Always tell a child who is wearing a helmet how cool you think their helmet is. It will encourage them to always wear it in the future.,134605,kzkotx,121145,LifeProTips,13460,2021-01-1718:09:18,0,1785,mashingLumpkins
0,1623960763.0,2021-06-1720:12:43,"LPT: Don't be fooled by the ""working for a dream company"" ideology. You'll be much better off with an amazing boss at an average company who champions your work, allows you to develop mastery in your field, and gives you autonomy.",133915,o26lzm,120524,LifeProTips,13391,2021-06-1713:12:43,0,3102,WrongKielbasa
0,1613440927.0,2021-02-1602:02:07,LPT: Your company didn’t know you existed before you applied and won’t notice you when you’re gone. Take care of yourself.,125766,lkt2w8,115705,LifeProTips,10061,2021-02-1518:02:07,0,2505,CalJackBuddy
0,1623189282.0,2021-06-0821:54:42,"LPT: When you don't have all the facts, try to give people the most generous reason you can for their behaviour. Annoyingly slow driver? Maybe it's a mom with a birthday cake in the back. This mindset will gradually make you less reactive, more compassionate and more forgiving of your own bad days.",126220,nvfnp4,111074,LifeProTips,15146,2021-06-0814:54:42,0,2529,ContributionNarrow88
0,1629926660.0,2021-08-2521:24:20,We call upon Reddit to take action against the rampant Coronavirus misinformation on their website.,64503,pbkst9,41927,explainlikeimfive,22576,2021-08-2514:24:20,0,2,ELI5_Modteam
0,1611876924.0,2021-01-2823:35:24,ELI5: Stock Market Megathread,44983,l7ckr5,40935,explainlikeimfive,4048,2021-01-2815:35:24,0,8091,ELI5_Modteam
0,1627573368.0,2021-07-2915:42:48,ELI5 remembers u/bossgalaga,37348,otzyon,34734,explainlikeimfive,2614,2021-07-2908:42:48,0,817,ELI5_Modteam
